,service_id,origin,destination,tsp,train_type,departure,arrival,Singular,Infinita
0,IRYO_01-11-2025-06.05,60000,71801,IRYO,Frecciarossa,2025-11-01 06:05:00,2025-11-01 08:35:00,22,57
1,IRYO_01-11-2025-07.30,60000,04040,IRYO,Frecciarossa,2025-11-01 07:30:00,2025-11-01 08:50:00,25,53
2,IRYO_01-11-2025-07.30,60000,71801,IRYO,Frecciarossa,2025-11-01 07:30:00,2025-11-01 10:25:00,32,62
3,IRYO_01-11-2025-07.30,04040,71801,IRYO,Frecciarossa,2025-11-01 08:53:00,2025-11-01 10:25:00,23,58
4,IRYO_01-11-2025-10.35,60000,71801,IRYO,Frecciarossa,2025-11-01 10:35:00,2025-11-01 13:05:00,20,50
5,IRYO_01-11-2025-14.35,60000,04040,IRYO,Frecciarossa,2025-11-01 14:35:00,2025-11-01 15:55:00,25,64
6,IRYO_01-11-2025-14.35,60000,04104,IRYO,Frecciarossa,2025-11-01 14:35:00,2025-11-01 16:55:00,18,44
7,IRYO_01-11-2025-14.35,60000,71801,IRYO,Frecciarossa,2025-11-01 14:35:00,2025-11-01 17:35:00,30,74
8,IRYO_01-11-2025-14.35,04040,04104,IRYO,Frecciarossa,2025-11-01 15:58:00,2025-11-01 16:55:00,13,42
9,IRYO_01-11-2025-14.35,04040,71801,IRYO,Frecciarossa,2025-11-01 15:58:00,2025-11-01 17:35:00,24,53
10,IRYO_01-11-2025-14.35,04104,71801,IRYO,Frecciarossa,2025-11-01 16:58:00,2025-11-01 17:35:00,18,62
11,IRYO_01-11-2025-20.35,60000,71801,IRYO,Frecciarossa,2025-11-01 20:35:00,2025-11-01 23:05:00,18,44
12,IRYO_01-11-2025-06.04,71801,04040,IRYO,Frecciarossa,2025-11-01 06:04:00,2025-11-01 07:19:00,16,57
13,IRYO_01-11-2025-06.04,71801,60000,IRYO,Frecciarossa,2025-11-01 06:04:00,2025-11-01 08:59:00,33,64
14,IRYO_01-11-2025-06.04,04040,60000,IRYO,Frecciarossa,2025-11-01 07:22:00,2025-11-01 08:59:00,17,47
15,IRYO_01-11-2025-10.04,71801,04104,IRYO,Frecciarossa,2025-11-01 10:04:00,2025-11-01 10:34:00,17,49
16,IRYO_01-11-2025-10.04,71801,04040,IRYO,Frecciarossa,2025-11-01 10:04:00,2025-11-01 11:34:00,16,53
17,IRYO_01-11-2025-10.04,71801,60000,IRYO,Frecciarossa,2025-11-01 10:04:00,2025-11-01 13:04:00,22,49
18,IRYO_01-11-2025-10.04,04104,04040,IRYO,Frecciarossa,2025-11-01 10:37:00,2025-11-01 11:34:00,12,38
19,IRYO_01-11-2025-10.04,04104,60000,IRYO,Frecciarossa,2025-11-01 10:37:00,2025-11-01 13:04:00,18,56
20,IRYO_01-11-2025-10.04,04040,60000,IRYO,Frecciarossa,2025-11-01 11:37:00,2025-11-01 13:04:00,17,50
21,IRYO_01-11-2025-13.04,71801,60000,IRYO,Frecciarossa,2025-11-01 13:04:00,2025-11-01 15:34:00,17,60
22,IRYO_01-11-2025-17.04,71801,60000,IRYO,Frecciarossa,2025-11-01 17:04:00,2025-11-01 19:34:00,18,52
23,IRYO_01-11-2025-20.55,71801,60000,IRYO,Frecciarossa,2025-11-01 20:55:00,2025-11-01 23:25:00,15,50
24,IRYO_02-11-2025-06.05,60000,71801,IRYO,Frecciarossa,2025-11-02 06:05:00,2025-11-02 08:35:00,22,57
25,IRYO_02-11-2025-07.30,60000,04040,IRYO,Frecciarossa,2025-11-02 07:30:00,2025-11-02 08:50:00,25,53
26,IRYO_02-11-2025-07.30,60000,71801,IRYO,Frecciarossa,2025-11-02 07:30:00,2025-11-02 10:25:00,32,62
27,IRYO_02-11-2025-07.30,04040,71801,IRYO,Frecciarossa,2025-11-02 08:53:00,2025-11-02 10:25:00,23,58
28,IRYO_02-11-2025-10.35,60000,71801,IRYO,Frecciarossa,2025-11-02 10:35:00,2025-11-02 13:05:00,20,50
29,IRYO_02-11-2025-14.35,60000,04040,IRYO,Frecciarossa,2025-11-02 14:35:00,2025-11-02 15:55:00,25,64
30,IRYO_02-11-2025-14.35,60000,04104,IRYO,Frecciarossa,2025-11-02 14:35:00,2025-11-02 16:55:00,18,44
31,IRYO_02-11-2025-14.35,60000,71801,IRYO,Frecciarossa,2025-11-02 14:35:00,2025-11-02 17:35:00,30,74
32,IRYO_02-11-2025-14.35,04040,04104,IRYO,Frecciarossa,2025-11-02 15:58:00,2025-11-02 16:55:00,13,42
33,IRYO_02-11-2025-14.35,04040,71801,IRYO,Frecciarossa,2025-11-02 15:58:00,2025-11-02 17:35:00,24,53
34,IRYO_02-11-2025-14.35,04104,71801,IRYO,Frecciarossa,2025-11-02 16:58:00,2025-11-02 17:35:00,18,62
35,IRYO_02-11-2025-20.35,60000,71801,IRYO,Frecciarossa,2025-11-02 20:35:00,2025-11-02 23:05:00,18,44
36,IRYO_02-11-2025-06.04,71801,04040,IRYO,Frecciarossa,2025-11-02 06:04:00,2025-11-02 07:19:00,16,57
37,IRYO_02-11-2025-06.04,71801,60000,IRYO,Frecciarossa,2025-11-02 06:04:00,2025-11-02 08:59:00,33,64
38,IRYO_02-11-2025-06.04,04040,60000,IRYO,Frecciarossa,2025-11-02 07:22:00,2025-11-02 08:59:00,17,47
39,IRYO_02-11-2025-10.04,71801,04104,IRYO,Frecciarossa,2025-11-02 10:04:00,2025-11-02 10:34:00,17,49
40,IRYO_02-11-2025-10.04,71801,04040,IRYO,Frecciarossa,2025-11-02 10:04:00,2025-11-02 11:34:00,16,53
41,IRYO_02-11-2025-10.04,71801,60000,IRYO,Frecciarossa,2025-11-02 10:04:00,2025-11-02 13:04:00,22,49
42,IRYO_02-11-2025-10.04,04104,04040,IRYO,Frecciarossa,2025-11-02 10:37:00,2025-11-02 11:34:00,12,38
43,IRYO_02-11-2025-10.04,04104,60000,IRYO,Frecciarossa,2025-11-02 10:37:00,2025-11-02 13:04:00,18,56
44,IRYO_02-11-2025-10.04,04040,60000,IRYO,Frecciarossa,2025-11-02 11:37:00,2025-11-02 13:04:00,17,50
45,IRYO_02-11-2025-13.04,71801,60000,IRYO,Frecciarossa,2025-11-02 13:04:00,2025-11-02 15:34:00,17,60
46,IRYO_02-11-2025-17.04,71801,60000,IRYO,Frecciarossa,2025-11-02 17:04:00,2025-11-02 19:34:00,18,52
47,IRYO_02-11-2025-20.55,71801,60000,IRYO,Frecciarossa,2025-11-02 20:55:00,2025-11-02 23:25:00,15,50
48,IRYO_03-11-2025-06.05,60000,71801,IRYO,Frecciarossa,2025-11-03 06:05:00,2025-11-03 08:35:00,22,57
49,IRYO_03-11-2025-07.30,60000,04040,IRYO,Frecciarossa,2025-11-03 07:30:00,2025-11-03 08:50:00,25,53
50,IRYO_03-11-2025-07.30,60000,71801,IRYO,Frecciarossa,2025-11-03 07:30:00,2025-11-03 10:25:00,32,62
51,IRYO_03-11-2025-07.30,04040,71801,IRYO,Frecciarossa,2025-11-03 08:53:00,2025-11-03 10:25:00,23,58
52,IRYO_03-11-2025-10.35,60000,71801,IRYO,Frecciarossa,2025-11-03 10:35:00,2025-11-03 13:05:00,20,50
53,IRYO_03-11-2025-14.35,60000,04040,IRYO,Frecciarossa,2025-11-03 14:35:00,2025-11-03 15:55:00,25,64
54,IRYO_03-11-2025-14.35,60000,04104,IRYO,Frecciarossa,2025-11-03 14:35:00,2025-11-03 16:55:00,18,44
55,IRYO_03-11-2025-14.35,60000,71801,IRYO,Frecciarossa,2025-11-03 14:35:00,2025-11-03 17:35:00,30,74
56,IRYO_03-11-2025-14.35,04040,04104,IRYO,Frecciarossa,2025-11-03 15:58:00,2025-11-03 16:55:00,13,42
57,IRYO_03-11-2025-14.35,04040,71801,IRYO,Frecciarossa,2025-11-03 15:58:00,2025-11-03 17:35:00,24,53
58,IRYO_03-11-2025-14.35,04104,71801,IRYO,Frecciarossa,2025-11-03 16:58:00,2025-11-03 17:35:00,18,62
59,IRYO_03-11-2025-20.35,60000,71801,IRYO,Frecciarossa,2025-11-03 20:35:00,2025-11-03 23:05:00,18,44
60,IRYO_03-11-2025-06.04,71801,04040,IRYO,Frecciarossa,2025-11-03 06:04:00,2025-11-03 07:19:00,16,57
61,IRYO_03-11-2025-06.04,71801,60000,IRYO,Frecciarossa,2025-11-03 06:04:00,2025-11-03 08:59:00,33,64
62,IRYO_03-11-2025-06.04,04040,60000,IRYO,Frecciarossa,2025-11-03 07:22:00,2025-11-03 08:59:00,17,47
63,IRYO_03-11-2025-10.04,71801,04104,IRYO,Frecciarossa,2025-11-03 10:04:00,2025-11-03 10:34:00,17,49
64,IRYO_03-11-2025-10.04,71801,04040,IRYO,Frecciarossa,2025-11-03 10:04:00,2025-11-03 11:34:00,16,53
65,IRYO_03-11-2025-10.04,71801,60000,IRYO,Frecciarossa,2025-11-03 10:04:00,2025-11-03 13:04:00,22,49
66,IRYO_03-11-2025-10.04,04104,04040,IRYO,Frecciarossa,2025-11-03 10:37:00,2025-11-03 11:34:00,12,38
67,IRYO_03-11-2025-10.04,04104,60000,IRYO,Frecciarossa,2025-11-03 10:37:00,2025-11-03 13:04:00,18,56
68,IRYO_03-11-2025-10.04,04040,60000,IRYO,Frecciarossa,2025-11-03 11:37:00,2025-11-03 13:04:00,17,50
69,IRYO_03-11-2025-13.04,71801,60000,IRYO,Frecciarossa,2025-11-03 13:04:00,2025-11-03 15:34:00,17,60
70,IRYO_03-11-2025-17.04,71801,60000,IRYO,Frecciarossa,2025-11-03 17:04:00,2025-11-03 19:34:00,18,52
71,IRYO_03-11-2025-20.55,71801,60000,IRYO,Frecciarossa,2025-11-03 20:55:00,2025-11-03 23:25:00,15,50
72,IRYO_04-11-2025-06.05,60000,71801,IRYO,Frecciarossa,2025-11-04 06:05:00,2025-11-04 08:35:00,22,57
73,IRYO_04-11-2025-07.30,60000,04040,IRYO,Frecciarossa,2025-11-04 07:30:00,2025-11-04 08:50:00,25,53
74,IRYO_04-11-2025-07.30,60000,71801,IRYO,Frecciarossa,2025-11-04 07:30:00,2025-11-04 10:25:00,32,62
75,IRYO_04-11-2025-07.30,04040,71801,IRYO,Frecciarossa,2025-11-04 08:53:00,2025-11-04 10:25:00,23,58
76,IRYO_04-11-2025-10.35,60000,71801,IRYO,Frecciarossa,2025-11-04 10:35:00,2025-11-04 13:05:00,20,50
77,IRYO_04-11-2025-14.35,60000,04040,IRYO,Frecciarossa,2025-11-04 14:35:00,2025-11-04 15:55:00,25,64
78,IRYO_04-11-2025-14.35,60000,04104,IRYO,Frecciarossa,2025-11-04 14:35:00,2025-11-04 16:55:00,18,44
79,IRYO_04-11-2025-14.35,60000,71801,IRYO,Frecciarossa,2025-11-04 14:35:00,2025-11-04 17:35:00,30,74
80,IRYO_04-11-2025-14.35,04040,04104,IRYO,Frecciarossa,2025-11-04 15:58:00,2025-11-04 16:55:00,13,42
81,IRYO_04-11-2025-14.35,04040,71801,IRYO,Frecciarossa,2025-11-04 15:58:00,2025-11-04 17:35:00,24,53
82,IRYO_04-11-2025-14.35,04104,71801,IRYO,Frecciarossa,2025-11-04 16:58:00,2025-11-04 17:35:00,18,62
83,IRYO_04-11-2025-20.35,60000,71801,IRYO,Frecciarossa,2025-11-04 20:35:00,2025-11-04 23:05:00,18,44
84,IRYO_04-11-2025-06.04,71801,04040,IRYO,Frecciarossa,2025-11-04 06:04:00,2025-11-04 07:19:00,16,57
85,IRYO_04-11-2025-06.04,71801,60000,IRYO,Frecciarossa,2025-11-04 06:04:00,2025-11-04 08:59:00,33,64
86,IRYO_04-11-2025-06.04,04040,60000,IRYO,Frecciarossa,2025-11-04 07:22:00,2025-11-04 08:59:00,17,47
87,IRYO_04-11-2025-10.04,71801,04104,IRYO,Frecciarossa,2025-11-04 10:04:00,2025-11-04 10:34:00,17,49
88,IRYO_04-11-2025-10.04,71801,04040,IRYO,Frecciarossa,2025-11-04 10:04:00,2025-11-04 11:34:00,16,53
89,IRYO_04-11-2025-10.04,71801,60000,IRYO,Frecciarossa,2025-11-04 10:04:00,2025-11-04 13:04:00,22,49
90,IRYO_04-11-2025-10.04,04104,04040,IRYO,Frecciarossa,2025-11-04 10:37:00,2025-11-04 11:34:00,12,38
91,IRYO_04-11-2025-10.04,04104,60000,IRYO,Frecciarossa,2025-11-04 10:37:00,2025-11-04 13:04:00,18,56
92,IRYO_04-11-2025-10.04,04040,60000,IRYO,Frecciarossa,2025-11-04 11:37:00,2025-11-04 13:04:00,17,50
93,IRYO_04-11-2025-13.04,71801,60000,IRYO,Frecciarossa,2025-11-04 13:04:00,2025-11-04 15:34:00,17,60
94,IRYO_04-11-2025-17.04,71801,60000,IRYO,Frecciarossa,2025-11-04 17:04:00,2025-11-04 19:34:00,18,52
95,IRYO_04-11-2025-20.55,71801,60000,IRYO,Frecciarossa,2025-11-04 20:55:00,2025-11-04 23:25:00,15,50
96,IRYO_05-11-2025-06.05,60000,71801,IRYO,Frecciarossa,2025-11-05 06:05:00,2025-11-05 08:35:00,22,57
97,IRYO_05-11-2025-07.30,60000,04040,IRYO,Frecciarossa,2025-11-05 07:30:00,2025-11-05 08:50:00,25,53
98,IRYO_05-11-2025-07.30,60000,71801,IRYO,Frecciarossa,2025-11-05 07:30:00,2025-11-05 10:25:00,32,62
99,IRYO_05-11-2025-07.30,04040,71801,IRYO,Frecciarossa,2025-11-05 08:53:00,2025-11-05 10:25:00,23,58
100,IRYO_05-11-2025-10.35,60000,71801,IRYO,Frecciarossa,2025-11-05 10:35:00,2025-11-05 13:05:00,20,50
101,IRYO_05-11-2025-14.35,60000,04040,IRYO,Frecciarossa,2025-11-05 14:35:00,2025-11-05 15:55:00,25,64
102,IRYO_05-11-2025-14.35,60000,04104,IRYO,Frecciarossa,2025-11-05 14:35:00,2025-11-05 16:55:00,18,44
103,IRYO_05-11-2025-14.35,60000,71801,IRYO,Frecciarossa,2025-11-05 14:35:00,2025-11-05 17:35:00,30,74
104,IRYO_05-11-2025-14.35,04040,04104,IRYO,Frecciarossa,2025-11-05 15:58:00,2025-11-05 16:55:00,13,42
105,IRYO_05-11-2025-14.35,04040,71801,IRYO,Frecciarossa,2025-11-05 15:58:00,2025-11-05 17:35:00,24,53
106,IRYO_05-11-2025-14.35,04104,71801,IRYO,Frecciarossa,2025-11-05 16:58:00,2025-11-05 17:35:00,18,62
107,IRYO_05-11-2025-20.35,60000,71801,IRYO,Frecciarossa,2025-11-05 20:35:00,2025-11-05 23:05:00,18,44
108,IRYO_05-11-2025-06.04,71801,04040,IRYO,Frecciarossa,2025-11-05 06:04:00,2025-11-05 07:19:00,16,57
109,IRYO_05-11-2025-06.04,71801,60000,IRYO,Frecciarossa,2025-11-05 06:04:00,2025-11-05 08:59:00,33,64
110,IRYO_05-11-2025-06.04,04040,60000,IRYO,Frecciarossa,2025-11-05 07:22:00,2025-11-05 08:59:00,17,47
111,IRYO_05-11-2025-10.04,71801,04104,IRYO,Frecciarossa,2025-11-05 10:04:00,2025-11-05 10:34:00,17,49
112,IRYO_05-11-2025-10.04,71801,04040,IRYO,Frecciarossa,2025-11-05 10:04:00,2025-11-05 11:34:00,16,53
113,IRYO_05-11-2025-10.04,71801,60000,IRYO,Frecciarossa,2025-11-05 10:04:00,2025-11-05 13:04:00,22,49
114,IRYO_05-11-2025-10.04,04104,04040,IRYO,Frecciarossa,2025-11-05 10:37:00,2025-11-05 11:34:00,12,38
115,IRYO_05-11-2025-10.04,04104,60000,IRYO,Frecciarossa,2025-11-05 10:37:00,2025-11-05 13:04:00,18,56
116,IRYO_05-11-2025-10.04,04040,60000,IRYO,Frecciarossa,2025-11-05 11:37:00,2025-11-05 13:04:00,17,50
117,IRYO_05-11-2025-13.04,71801,60000,IRYO,Frecciarossa,2025-11-05 13:04:00,2025-11-05 15:34:00,17,60
118,IRYO_05-11-2025-17.04,71801,60000,IRYO,Frecciarossa,2025-11-05 17:04:00,2025-11-05 19:34:00,18,52
119,IRYO_05-11-2025-20.55,71801,60000,IRYO,Frecciarossa,2025-11-05 20:55:00,2025-11-05 23:25:00,15,50
120,IRYO_06-11-2025-06.05,60000,71801,IRYO,Frecciarossa,2025-11-06 06:05:00,2025-11-06 08:35:00,22,57
121,IRYO_06-11-2025-07.30,60000,04040,IRYO,Frecciarossa,2025-11-06 07:30:00,2025-11-06 08:50:00,25,53
122,IRYO_06-11-2025-07.30,60000,71801,IRYO,Frecciarossa,2025-11-06 07:30:00,2025-11-06 10:25:00,32,62
123,IRYO_06-11-2025-07.30,04040,71801,IRYO,Frecciarossa,2025-11-06 08:53:00,2025-11-06 10:25:00,23,58
124,IRYO_06-11-2025-10.35,60000,71801,IRYO,Frecciarossa,2025-11-06 10:35:00,2025-11-06 13:05:00,20,50
125,IRYO_06-11-2025-14.35,60000,04040,IRYO,Frecciarossa,2025-11-06 14:35:00,2025-11-06 15:55:00,25,64
126,IRYO_06-11-2025-14.35,60000,04104,IRYO,Frecciarossa,2025-11-06 14:35:00,2025-11-06 16:55:00,18,44
127,IRYO_06-11-2025-14.35,60000,71801,IRYO,Frecciarossa,2025-11-06 14:35:00,2025-11-06 17:35:00,30,74
128,IRYO_06-11-2025-14.35,04040,04104,IRYO,Frecciarossa,2025-11-06 15:58:00,2025-11-06 16:55:00,13,42
129,IRYO_06-11-2025-14.35,04040,71801,IRYO,Frecciarossa,2025-11-06 15:58:00,2025-11-06 17:35:00,24,53
130,IRYO_06-11-2025-14.35,04104,71801,IRYO,Frecciarossa,2025-11-06 16:58:00,2025-11-06 17:35:00,18,62
131,IRYO_06-11-2025-20.35,60000,71801,IRYO,Frecciarossa,2025-11-06 20:35:00,2025-11-06 23:05:00,18,44
132,IRYO_06-11-2025-06.04,71801,04040,IRYO,Frecciarossa,2025-11-06 06:04:00,2025-11-06 07:19:00,16,57
133,IRYO_06-11-2025-06.04,71801,60000,IRYO,Frecciarossa,2025-11-06 06:04:00,2025-11-06 08:59:00,33,64
134,IRYO_06-11-2025-06.04,04040,60000,IRYO,Frecciarossa,2025-11-06 07:22:00,2025-11-06 08:59:00,17,47
135,IRYO_06-11-2025-10.04,71801,04104,IRYO,Frecciarossa,2025-11-06 10:04:00,2025-11-06 10:34:00,17,49
136,IRYO_06-11-2025-10.04,71801,04040,IRYO,Frecciarossa,2025-11-06 10:04:00,2025-11-06 11:34:00,16,53
137,IRYO_06-11-2025-10.04,71801,60000,IRYO,Frecciarossa,2025-11-06 10:04:00,2025-11-06 13:04:00,22,49
138,IRYO_06-11-2025-10.04,04104,04040,IRYO,Frecciarossa,2025-11-06 10:37:00,2025-11-06 11:34:00,12,38
139,IRYO_06-11-2025-10.04,04104,60000,IRYO,Frecciarossa,2025-11-06 10:37:00,2025-11-06 13:04:00,18,56
140,IRYO_06-11-2025-10.04,04040,60000,IRYO,Frecciarossa,2025-11-06 11:37:00,2025-11-06 13:04:00,17,50
141,IRYO_06-11-2025-13.04,71801,60000,IRYO,Frecciarossa,2025-11-06 13:04:00,2025-11-06 15:34:00,17,60
142,IRYO_06-11-2025-17.04,71801,60000,IRYO,Frecciarossa,2025-11-06 17:04:00,2025-11-06 19:34:00,18,52
143,IRYO_06-11-2025-20.55,71801,60000,IRYO,Frecciarossa,2025-11-06 20:55:00,2025-11-06 23:25:00,15,50
144,IRYO_07-11-2025-06.05,60000,71801,IRYO,Frecciarossa,2025-11-07 06:05:00,2025-11-07 08:35:00,22,57
145,IRYO_07-11-2025-07.30,60000,04040,IRYO,Frecciarossa,2025-11-07 07:30:00,2025-11-07 08:50:00,25,53
146,IRYO_07-11-2025-07.30,60000,71801,IRYO,Frecciarossa,2025-11-07 07:30:00,2025-11-07 10:25:00,32,62
147,IRYO_07-11-2025-07.30,04040,71801,IRYO,Frecciarossa,2025-11-07 08:53:00,2025-11-07 10:25:00,23,58
148,IRYO_07-11-2025-10.35,60000,71801,IRYO,Frecciarossa,2025-11-07 10:35:00,2025-11-07 13:05:00,20,50
149,IRYO_07-11-2025-14.35,60000,04040,IRYO,Frecciarossa,2025-11-07 14:35:00,2025-11-07 15:55:00,25,64
150,IRYO_07-11-2025-14.35,60000,04104,IRYO,Frecciarossa,2025-11-07 14:35:00,2025-11-07 16:55:00,18,44
151,IRYO_07-11-2025-14.35,60000,71801,IRYO,Frecciarossa,2025-11-07 14:35:00,2025-11-07 17:35:00,30,74
152,IRYO_07-11-2025-14.35,04040,04104,IRYO,Frecciarossa,2025-11-07 15:58:00,2025-11-07 16:55:00,13,42
153,IRYO_07-11-2025-14.35,04040,71801,IRYO,Frecciarossa,2025-11-07 15:58:00,2025-11-07 17:35:00,24,53
154,IRYO_07-11-2025-14.35,04104,71801,IRYO,Frecciarossa,2025-11-07 16:58:00,2025-11-07 17:35:00,18,62
155,IRYO_07-11-2025-20.35,60000,71801,IRYO,Frecciarossa,2025-11-07 20:35:00,2025-11-07 23:05:00,18,44
156,IRYO_07-11-2025-06.04,71801,04040,IRYO,Frecciarossa,2025-11-07 06:04:00,2025-11-07 07:19:00,16,57
157,IRYO_07-11-2025-06.04,71801,60000,IRYO,Frecciarossa,2025-11-07 06:04:00,2025-11-07 08:59:00,33,64
158,IRYO_07-11-2025-06.04,04040,60000,IRYO,Frecciarossa,2025-11-07 07:22:00,2025-11-07 08:59:00,17,47
159,IRYO_07-11-2025-10.04,71801,04104,IRYO,Frecciarossa,2025-11-07 10:04:00,2025-11-07 10:34:00,17,49
160,IRYO_07-11-2025-10.04,71801,04040,IRYO,Frecciarossa,2025-11-07 10:04:00,2025-11-07 11:34:00,16,53
161,IRYO_07-11-2025-10.04,71801,60000,IRYO,Frecciarossa,2025-11-07 10:04:00,2025-11-07 13:04:00,22,49
162,IRYO_07-11-2025-10.04,04104,04040,IRYO,Frecciarossa,2025-11-07 10:37:00,2025-11-07 11:34:00,12,38
163,IRYO_07-11-2025-10.04,04104,60000,IRYO,Frecciarossa,2025-11-07 10:37:00,2025-11-07 13:04:00,18,56
164,IRYO_07-11-2025-10.04,04040,60000,IRYO,Frecciarossa,2025-11-07 11:37:00,2025-11-07 13:04:00,17,50
165,IRYO_07-11-2025-13.04,71801,60000,IRYO,Frecciarossa,2025-11-07 13:04:00,2025-11-07 15:34:00,17,60
166,IRYO_07-11-2025-17.04,71801,60000,IRYO,Frecciarossa,2025-11-07 17:04:00,2025-11-07 19:34:00,18,52
167,IRYO_07-11-2025-20.55,71801,60000,IRYO,Frecciarossa,2025-11-07 20:55:00,2025-11-07 23:25:00,15,50
168,IRYO_08-11-2025-06.05,60000,71801,IRYO,Frecciarossa,2025-11-08 06:05:00,2025-11-08 08:35:00,22,57
169,IRYO_08-11-2025-07.30,60000,04040,IRYO,Frecciarossa,2025-11-08 07:30:00,2025-11-08 08:50:00,25,53
170,IRYO_08-11-2025-07.30,60000,71801,IRYO,Frecciarossa,2025-11-08 07:30:00,2025-11-08 10:25:00,32,62
171,IRYO_08-11-2025-07.30,04040,71801,IRYO,Frecciarossa,2025-11-08 08:53:00,2025-11-08 10:25:00,23,58
172,IRYO_08-11-2025-10.35,60000,71801,IRYO,Frecciarossa,2025-11-08 10:35:00,2025-11-08 13:05:00,20,50
173,IRYO_08-11-2025-14.35,60000,04040,IRYO,Frecciarossa,2025-11-08 14:35:00,2025-11-08 15:55:00,25,64
174,IRYO_08-11-2025-14.35,60000,04104,IRYO,Frecciarossa,2025-11-08 14:35:00,2025-11-08 16:55:00,18,44
175,IRYO_08-11-2025-14.35,60000,71801,IRYO,Frecciarossa,2025-11-08 14:35:00,2025-11-08 17:35:00,30,74
176,IRYO_08-11-2025-14.35,04040,04104,IRYO,Frecciarossa,2025-11-08 15:58:00,2025-11-08 16:55:00,13,42
177,IRYO_08-11-2025-14.35,04040,71801,IRYO,Frecciarossa,2025-11-08 15:58:00,2025-11-08 17:35:00,24,53
178,IRYO_08-11-2025-14.35,04104,71801,IRYO,Frecciarossa,2025-11-08 16:58:00,2025-11-08 17:35:00,18,62
179,IRYO_08-11-2025-20.35,60000,71801,IRYO,Frecciarossa,2025-11-08 20:35:00,2025-11-08 23:05:00,18,44
180,IRYO_08-11-2025-06.04,71801,04040,IRYO,Frecciarossa,2025-11-08 06:04:00,2025-11-08 07:19:00,16,57
181,IRYO_08-11-2025-06.04,71801,60000,IRYO,Frecciarossa,2025-11-08 06:04:00,2025-11-08 08:59:00,33,64
182,IRYO_08-11-2025-06.04,04040,60000,IRYO,Frecciarossa,2025-11-08 07:22:00,2025-11-08 08:59:00,17,47
183,IRYO_08-11-2025-10.04,71801,04104,IRYO,Frecciarossa,2025-11-08 10:04:00,2025-11-08 10:34:00,17,49
184,IRYO_08-11-2025-10.04,71801,04040,IRYO,Frecciarossa,2025-11-08 10:04:00,2025-11-08 11:34:00,16,53
185,IRYO_08-11-2025-10.04,71801,60000,IRYO,Frecciarossa,2025-11-08 10:04:00,2025-11-08 13:04:00,22,49
186,IRYO_08-11-2025-10.04,04104,04040,IRYO,Frecciarossa,2025-11-08 10:37:00,2025-11-08 11:34:00,12,38
187,IRYO_08-11-2025-10.04,04104,60000,IRYO,Frecciarossa,2025-11-08 10:37:00,2025-11-08 13:04:00,18,56
188,IRYO_08-11-2025-10.04,04040,60000,IRYO,Frecciarossa,2025-11-08 11:37:00,2025-11-08 13:04:00,17,50
189,IRYO_08-11-2025-13.04,71801,60000,IRYO,Frecciarossa,2025-11-08 13:04:00,2025-11-08 15:34:00,17,60
190,IRYO_08-11-2025-17.04,71801,60000,IRYO,Frecciarossa,2025-11-08 17:04:00,2025-11-08 19:34:00,18,52
191,IRYO_08-11-2025-20.55,71801,60000,IRYO,Frecciarossa,2025-11-08 20:55:00,2025-11-08 23:25:00,15,50
192,IRYO_09-11-2025-06.05,60000,71801,IRYO,Frecciarossa,2025-11-09 06:05:00,2025-11-09 08:35:00,22,57
193,IRYO_09-11-2025-07.30,60000,04040,IRYO,Frecciarossa,2025-11-09 07:30:00,2025-11-09 08:50:00,25,53
194,IRYO_09-11-2025-07.30,60000,71801,IRYO,Frecciarossa,2025-11-09 07:30:00,2025-11-09 10:25:00,32,62
195,IRYO_09-11-2025-07.30,04040,71801,IRYO,Frecciarossa,2025-11-09 08:53:00,2025-11-09 10:25:00,23,58
196,IRYO_09-11-2025-10.35,60000,71801,IRYO,Frecciarossa,2025-11-09 10:35:00,2025-11-09 13:05:00,20,50
197,IRYO_09-11-2025-14.35,60000,04040,IRYO,Frecciarossa,2025-11-09 14:35:00,2025-11-09 15:55:00,25,64
198,IRYO_09-11-2025-14.35,60000,04104,IRYO,Frecciarossa,2025-11-09 14:35:00,2025-11-09 16:55:00,18,44
199,IRYO_09-11-2025-14.35,60000,71801,IRYO,Frecciarossa,2025-11-09 14:35:00,2025-11-09 17:35:00,30,74
200,IRYO_09-11-2025-14.35,04040,04104,IRYO,Frecciarossa,2025-11-09 15:58:00,2025-11-09 16:55:00,13,42
201,IRYO_09-11-2025-14.35,04040,71801,IRYO,Frecciarossa,2025-11-09 15:58:00,2025-11-09 17:35:00,24,53
202,IRYO_09-11-2025-14.35,04104,71801,IRYO,Frecciarossa,2025-11-09 16:58:00,2025-11-09 17:35:00,18,62
203,IRYO_09-11-2025-20.35,60000,71801,IRYO,Frecciarossa,2025-11-09 20:35:00,2025-11-09 23:05:00,18,44
204,IRYO_09-11-2025-06.04,71801,04040,IRYO,Frecciarossa,2025-11-09 06:04:00,2025-11-09 07:19:00,16,57
205,IRYO_09-11-2025-06.04,71801,60000,IRYO,Frecciarossa,2025-11-09 06:04:00,2025-11-09 08:59:00,33,64
206,IRYO_09-11-2025-06.04,04040,60000,IRYO,Frecciarossa,2025-11-09 07:22:00,2025-11-09 08:59:00,17,47
207,IRYO_09-11-2025-10.04,71801,04104,IRYO,Frecciarossa,2025-11-09 10:04:00,2025-11-09 10:34:00,17,49
208,IRYO_09-11-2025-10.04,71801,04040,IRYO,Frecciarossa,2025-11-09 10:04:00,2025-11-09 11:34:00,16,53
209,IRYO_09-11-2025-10.04,71801,60000,IRYO,Frecciarossa,2025-11-09 10:04:00,2025-11-09 13:04:00,22,49
210,IRYO_09-11-2025-10.04,04104,04040,IRYO,Frecciarossa,2025-11-09 10:37:00,2025-11-09 11:34:00,12,38
211,IRYO_09-11-2025-10.04,04104,60000,IRYO,Frecciarossa,2025-11-09 10:37:00,2025-11-09 13:04:00,18,56
212,IRYO_09-11-2025-10.04,04040,60000,IRYO,Frecciarossa,2025-11-09 11:37:00,2025-11-09 13:04:00,17,50
213,IRYO_09-11-2025-13.04,71801,60000,IRYO,Frecciarossa,2025-11-09 13:04:00,2025-11-09 15:34:00,17,60
214,IRYO_09-11-2025-17.04,71801,60000,IRYO,Frecciarossa,2025-11-09 17:04:00,2025-11-09 19:34:00,18,52
215,IRYO_09-11-2025-20.55,71801,60000,IRYO,Frecciarossa,2025-11-09 20:55:00,2025-11-09 23:25:00,15,50
216,IRYO_10-11-2025-06.05,60000,71801,IRYO,Frecciarossa,2025-11-10 06:05:00,2025-11-10 08:35:00,22,57
217,IRYO_10-11-2025-07.30,60000,04040,IRYO,Frecciarossa,2025-11-10 07:30:00,2025-11-10 08:50:00,25,53
218,IRYO_10-11-2025-07.30,60000,71801,IRYO,Frecciarossa,2025-11-10 07:30:00,2025-11-10 10:25:00,32,62
219,IRYO_10-11-2025-07.30,04040,71801,IRYO,Frecciarossa,2025-11-10 08:53:00,2025-11-10 10:25:00,23,58
220,IRYO_10-11-2025-10.35,60000,71801,IRYO,Frecciarossa,2025-11-10 10:35:00,2025-11-10 13:05:00,20,50
221,IRYO_10-11-2025-14.35,60000,04040,IRYO,Frecciarossa,2025-11-10 14:35:00,2025-11-10 15:55:00,25,64
222,IRYO_10-11-2025-14.35,60000,04104,IRYO,Frecciarossa,2025-11-10 14:35:00,2025-11-10 16:55:00,18,44
223,IRYO_10-11-2025-14.35,60000,71801,IRYO,Frecciarossa,2025-11-10 14:35:00,2025-11-10 17:35:00,30,74
224,IRYO_10-11-2025-14.35,04040,04104,IRYO,Frecciarossa,2025-11-10 15:58:00,2025-11-10 16:55:00,13,42
225,IRYO_10-11-2025-14.35,04040,71801,IRYO,Frecciarossa,2025-11-10 15:58:00,2025-11-10 17:35:00,24,53
226,IRYO_10-11-2025-14.35,04104,71801,IRYO,Frecciarossa,2025-11-10 16:58:00,2025-11-10 17:35:00,18,62
227,IRYO_10-11-2025-20.35,60000,71801,IRYO,Frecciarossa,2025-11-10 20:35:00,2025-11-10 23:05:00,18,44
228,IRYO_10-11-2025-06.04,71801,04040,IRYO,Frecciarossa,2025-11-10 06:04:00,2025-11-10 07:19:00,16,57
229,IRYO_10-11-2025-06.04,71801,60000,IRYO,Frecciarossa,2025-11-10 06:04:00,2025-11-10 08:59:00,33,64
230,IRYO_10-11-2025-06.04,04040,60000,IRYO,Frecciarossa,2025-11-10 07:22:00,2025-11-10 08:59:00,17,47
231,IRYO_10-11-2025-10.04,71801,04104,IRYO,Frecciarossa,2025-11-10 10:04:00,2025-11-10 10:34:00,17,49
232,IRYO_10-11-2025-10.04,71801,04040,IRYO,Frecciarossa,2025-11-10 10:04:00,2025-11-10 11:34:00,16,53
233,IRYO_10-11-2025-10.04,71801,60000,IRYO,Frecciarossa,2025-11-10 10:04:00,2025-11-10 13:04:00,22,49
234,IRYO_10-11-2025-10.04,04104,04040,IRYO,Frecciarossa,2025-11-10 10:37:00,2025-11-10 11:34:00,12,38
235,IRYO_10-11-2025-10.04,04104,60000,IRYO,Frecciarossa,2025-11-10 10:37:00,2025-11-10 13:04:00,18,56
236,IRYO_10-11-2025-10.04,04040,60000,IRYO,Frecciarossa,2025-11-10 11:37:00,2025-11-10 13:04:00,17,50
237,IRYO_10-11-2025-13.04,71801,60000,IRYO,Frecciarossa,2025-11-10 13:04:00,2025-11-10 15:34:00,17,60
238,IRYO_10-11-2025-17.04,71801,60000,IRYO,Frecciarossa,2025-11-10 17:04:00,2025-11-10 19:34:00,18,52
239,IRYO_10-11-2025-20.55,71801,60000,IRYO,Frecciarossa,2025-11-10 20:55:00,2025-11-10 23:25:00,15,50
240,IRYO_11-11-2025-06.05,60000,71801,IRYO,Frecciarossa,2025-11-11 06:05:00,2025-11-11 08:35:00,22,57
241,IRYO_11-11-2025-07.30,60000,04040,IRYO,Frecciarossa,2025-11-11 07:30:00,2025-11-11 08:50:00,25,53
242,IRYO_11-11-2025-07.30,60000,71801,IRYO,Frecciarossa,2025-11-11 07:30:00,2025-11-11 10:25:00,32,62
243,IRYO_11-11-2025-07.30,04040,71801,IRYO,Frecciarossa,2025-11-11 08:53:00,2025-11-11 10:25:00,23,58
244,IRYO_11-11-2025-10.35,60000,71801,IRYO,Frecciarossa,2025-11-11 10:35:00,2025-11-11 13:05:00,20,50
245,IRYO_11-11-2025-14.35,60000,04040,IRYO,Frecciarossa,2025-11-11 14:35:00,2025-11-11 15:55:00,25,64
246,IRYO_11-11-2025-14.35,60000,04104,IRYO,Frecciarossa,2025-11-11 14:35:00,2025-11-11 16:55:00,18,44
247,IRYO_11-11-2025-14.35,60000,71801,IRYO,Frecciarossa,2025-11-11 14:35:00,2025-11-11 17:35:00,30,74
248,IRYO_11-11-2025-14.35,04040,04104,IRYO,Frecciarossa,2025-11-11 15:58:00,2025-11-11 16:55:00,13,42
249,IRYO_11-11-2025-14.35,04040,71801,IRYO,Frecciarossa,2025-11-11 15:58:00,2025-11-11 17:35:00,24,53
250,IRYO_11-11-2025-14.35,04104,71801,IRYO,Frecciarossa,2025-11-11 16:58:00,2025-11-11 17:35:00,18,62
251,IRYO_11-11-2025-20.35,60000,71801,IRYO,Frecciarossa,2025-11-11 20:35:00,2025-11-11 23:05:00,18,44
252,IRYO_11-11-2025-06.04,71801,04040,IRYO,Frecciarossa,2025-11-11 06:04:00,2025-11-11 07:19:00,16,57
253,IRYO_11-11-2025-06.04,71801,60000,IRYO,Frecciarossa,2025-11-11 06:04:00,2025-11-11 08:59:00,33,64
254,IRYO_11-11-2025-06.04,04040,60000,IRYO,Frecciarossa,2025-11-11 07:22:00,2025-11-11 08:59:00,17,47
255,IRYO_11-11-2025-10.04,71801,04104,IRYO,Frecciarossa,2025-11-11 10:04:00,2025-11-11 10:34:00,17,49
256,IRYO_11-11-2025-10.04,71801,04040,IRYO,Frecciarossa,2025-11-11 10:04:00,2025-11-11 11:34:00,16,53
257,IRYO_11-11-2025-10.04,71801,60000,IRYO,Frecciarossa,2025-11-11 10:04:00,2025-11-11 13:04:00,22,49
258,IRYO_11-11-2025-10.04,04104,04040,IRYO,Frecciarossa,2025-11-11 10:37:00,2025-11-11 11:34:00,12,38
259,IRYO_11-11-2025-10.04,04104,60000,IRYO,Frecciarossa,2025-11-11 10:37:00,2025-11-11 13:04:00,18,56
260,IRYO_11-11-2025-10.04,04040,60000,IRYO,Frecciarossa,2025-11-11 11:37:00,2025-11-11 13:04:00,17,50
261,IRYO_11-11-2025-13.04,71801,60000,IRYO,Frecciarossa,2025-11-11 13:04:00,2025-11-11 15:34:00,17,60
262,IRYO_11-11-2025-17.04,71801,60000,IRYO,Frecciarossa,2025-11-11 17:04:00,2025-11-11 19:34:00,18,52
263,IRYO_11-11-2025-20.55,71801,60000,IRYO,Frecciarossa,2025-11-11 20:55:00,2025-11-11 23:25:00,15,50
264,IRYO_12-11-2025-06.05,60000,71801,IRYO,Frecciarossa,2025-11-12 06:05:00,2025-11-12 08:35:00,22,57
265,IRYO_12-11-2025-07.30,60000,04040,IRYO,Frecciarossa,2025-11-12 07:30:00,2025-11-12 08:50:00,25,53
266,IRYO_12-11-2025-07.30,60000,71801,IRYO,Frecciarossa,2025-11-12 07:30:00,2025-11-12 10:25:00,32,62
267,IRYO_12-11-2025-07.30,04040,71801,IRYO,Frecciarossa,2025-11-12 08:53:00,2025-11-12 10:25:00,23,58
268,IRYO_12-11-2025-10.35,60000,71801,IRYO,Frecciarossa,2025-11-12 10:35:00,2025-11-12 13:05:00,20,50
269,IRYO_12-11-2025-14.35,60000,04040,IRYO,Frecciarossa,2025-11-12 14:35:00,2025-11-12 15:55:00,25,64
270,IRYO_12-11-2025-14.35,60000,04104,IRYO,Frecciarossa,2025-11-12 14:35:00,2025-11-12 16:55:00,18,44
271,IRYO_12-11-2025-14.35,60000,71801,IRYO,Frecciarossa,2025-11-12 14:35:00,2025-11-12 17:35:00,30,74
272,IRYO_12-11-2025-14.35,04040,04104,IRYO,Frecciarossa,2025-11-12 15:58:00,2025-11-12 16:55:00,13,42
273,IRYO_12-11-2025-14.35,04040,71801,IRYO,Frecciarossa,2025-11-12 15:58:00,2025-11-12 17:35:00,24,53
274,IRYO_12-11-2025-14.35,04104,71801,IRYO,Frecciarossa,2025-11-12 16:58:00,2025-11-12 17:35:00,18,62
275,IRYO_12-11-2025-20.35,60000,71801,IRYO,Frecciarossa,2025-11-12 20:35:00,2025-11-12 23:05:00,18,44
276,IRYO_12-11-2025-06.04,71801,04040,IRYO,Frecciarossa,2025-11-12 06:04:00,2025-11-12 07:19:00,16,57
277,IRYO_12-11-2025-06.04,71801,60000,IRYO,Frecciarossa,2025-11-12 06:04:00,2025-11-12 08:59:00,33,64
278,IRYO_12-11-2025-06.04,04040,60000,IRYO,Frecciarossa,2025-11-12 07:22:00,2025-11-12 08:59:00,17,47
279,IRYO_12-11-2025-10.04,71801,04104,IRYO,Frecciarossa,2025-11-12 10:04:00,2025-11-12 10:34:00,17,49
280,IRYO_12-11-2025-10.04,71801,04040,IRYO,Frecciarossa,2025-11-12 10:04:00,2025-11-12 11:34:00,16,53
281,IRYO_12-11-2025-10.04,71801,60000,IRYO,Frecciarossa,2025-11-12 10:04:00,2025-11-12 13:04:00,22,49
282,IRYO_12-11-2025-10.04,04104,04040,IRYO,Frecciarossa,2025-11-12 10:37:00,2025-11-12 11:34:00,12,38
283,IRYO_12-11-2025-10.04,04104,60000,IRYO,Frecciarossa,2025-11-12 10:37:00,2025-11-12 13:04:00,18,56
284,IRYO_12-11-2025-10.04,04040,60000,IRYO,Frecciarossa,2025-11-12 11:37:00,2025-11-12 13:04:00,17,50
285,IRYO_12-11-2025-13.04,71801,60000,IRYO,Frecciarossa,2025-11-12 13:04:00,2025-11-12 15:34:00,17,60
286,IRYO_12-11-2025-17.04,71801,60000,IRYO,Frecciarossa,2025-11-12 17:04:00,2025-11-12 19:34:00,18,52
287,IRYO_12-11-2025-20.55,71801,60000,IRYO,Frecciarossa,2025-11-12 20:55:00,2025-11-12 23:25:00,15,50
288,IRYO_13-11-2025-06.05,60000,71801,IRYO,Frecciarossa,2025-11-13 06:05:00,2025-11-13 08:35:00,22,57
289,IRYO_13-11-2025-07.30,60000,04040,IRYO,Frecciarossa,2025-11-13 07:30:00,2025-11-13 08:50:00,25,53
290,IRYO_13-11-2025-07.30,60000,71801,IRYO,Frecciarossa,2025-11-13 07:30:00,2025-11-13 10:25:00,32,62
291,IRYO_13-11-2025-07.30,04040,71801,IRYO,Frecciarossa,2025-11-13 08:53:00,2025-11-13 10:25:00,23,58
292,IRYO_13-11-2025-10.35,60000,71801,IRYO,Frecciarossa,2025-11-13 10:35:00,2025-11-13 13:05:00,20,50
293,IRYO_13-11-2025-14.35,60000,04040,IRYO,Frecciarossa,2025-11-13 14:35:00,2025-11-13 15:55:00,25,64
294,IRYO_13-11-2025-14.35,60000,04104,IRYO,Frecciarossa,2025-11-13 14:35:00,2025-11-13 16:55:00,18,44
295,IRYO_13-11-2025-14.35,60000,71801,IRYO,Frecciarossa,2025-11-13 14:35:00,2025-11-13 17:35:00,30,74
296,IRYO_13-11-2025-14.35,04040,04104,IRYO,Frecciarossa,2025-11-13 15:58:00,2025-11-13 16:55:00,13,42
297,IRYO_13-11-2025-14.35,04040,71801,IRYO,Frecciarossa,2025-11-13 15:58:00,2025-11-13 17:35:00,24,53
298,IRYO_13-11-2025-14.35,04104,71801,IRYO,Frecciarossa,2025-11-13 16:58:00,2025-11-13 17:35:00,18,62
299,IRYO_13-11-2025-20.35,60000,71801,IRYO,Frecciarossa,2025-11-13 20:35:00,2025-11-13 23:05:00,18,44
300,IRYO_13-11-2025-06.04,71801,04040,IRYO,Frecciarossa,2025-11-13 06:04:00,2025-11-13 07:19:00,16,57
301,IRYO_13-11-2025-06.04,71801,60000,IRYO,Frecciarossa,2025-11-13 06:04:00,2025-11-13 08:59:00,33,64
302,IRYO_13-11-2025-06.04,04040,60000,IRYO,Frecciarossa,2025-11-13 07:22:00,2025-11-13 08:59:00,17,47
303,IRYO_13-11-2025-10.04,71801,04104,IRYO,Frecciarossa,2025-11-13 10:04:00,2025-11-13 10:34:00,17,49
304,IRYO_13-11-2025-10.04,71801,04040,IRYO,Frecciarossa,2025-11-13 10:04:00,2025-11-13 11:34:00,16,53
305,IRYO_13-11-2025-10.04,71801,60000,IRYO,Frecciarossa,2025-11-13 10:04:00,2025-11-13 13:04:00,22,49
306,IRYO_13-11-2025-10.04,04104,04040,IRYO,Frecciarossa,2025-11-13 10:37:00,2025-11-13 11:34:00,12,38
307,IRYO_13-11-2025-10.04,04104,60000,IRYO,Frecciarossa,2025-11-13 10:37:00,2025-11-13 13:04:00,18,56
308,IRYO_13-11-2025-10.04,04040,60000,IRYO,Frecciarossa,2025-11-13 11:37:00,2025-11-13 13:04:00,17,50
309,IRYO_13-11-2025-13.04,71801,60000,IRYO,Frecciarossa,2025-11-13 13:04:00,2025-11-13 15:34:00,17,60
310,IRYO_13-11-2025-17.04,71801,60000,IRYO,Frecciarossa,2025-11-13 17:04:00,2025-11-13 19:34:00,18,52
311,IRYO_13-11-2025-20.55,71801,60000,IRYO,Frecciarossa,2025-11-13 20:55:00,2025-11-13 23:25:00,15,50
312,IRYO_14-11-2025-06.05,60000,71801,IRYO,Frecciarossa,2025-11-14 06:05:00,2025-11-14 08:35:00,22,57
313,IRYO_14-11-2025-07.30,60000,04040,IRYO,Frecciarossa,2025-11-14 07:30:00,2025-11-14 08:50:00,25,53
314,IRYO_14-11-2025-07.30,60000,71801,IRYO,Frecciarossa,2025-11-14 07:30:00,2025-11-14 10:25:00,32,62
315,IRYO_14-11-2025-07.30,04040,71801,IRYO,Frecciarossa,2025-11-14 08:53:00,2025-11-14 10:25:00,23,58
316,IRYO_14-11-2025-10.35,60000,71801,IRYO,Frecciarossa,2025-11-14 10:35:00,2025-11-14 13:05:00,20,50
317,IRYO_14-11-2025-14.35,60000,04040,IRYO,Frecciarossa,2025-11-14 14:35:00,2025-11-14 15:55:00,25,64
318,IRYO_14-11-2025-14.35,60000,04104,IRYO,Frecciarossa,2025-11-14 14:35:00,2025-11-14 16:55:00,18,44
319,IRYO_14-11-2025-14.35,60000,71801,IRYO,Frecciarossa,2025-11-14 14:35:00,2025-11-14 17:35:00,30,74
320,IRYO_14-11-2025-14.35,04040,04104,IRYO,Frecciarossa,2025-11-14 15:58:00,2025-11-14 16:55:00,13,42
321,IRYO_14-11-2025-14.35,04040,71801,IRYO,Frecciarossa,2025-11-14 15:58:00,2025-11-14 17:35:00,24,53
322,IRYO_14-11-2025-14.35,04104,71801,IRYO,Frecciarossa,2025-11-14 16:58:00,2025-11-14 17:35:00,18,62
323,IRYO_14-11-2025-20.35,60000,71801,IRYO,Frecciarossa,2025-11-14 20:35:00,2025-11-14 23:05:00,18,44
324,IRYO_14-11-2025-06.04,71801,04040,IRYO,Frecciarossa,2025-11-14 06:04:00,2025-11-14 07:19:00,16,57
325,IRYO_14-11-2025-06.04,71801,60000,IRYO,Frecciarossa,2025-11-14 06:04:00,2025-11-14 08:59:00,33,64
326,IRYO_14-11-2025-06.04,04040,60000,IRYO,Frecciarossa,2025-11-14 07:22:00,2025-11-14 08:59:00,17,47
327,IRYO_14-11-2025-10.04,71801,04104,IRYO,Frecciarossa,2025-11-14 10:04:00,2025-11-14 10:34:00,17,49
328,IRYO_14-11-2025-10.04,71801,04040,IRYO,Frecciarossa,2025-11-14 10:04:00,2025-11-14 11:34:00,16,53
329,IRYO_14-11-2025-10.04,71801,60000,IRYO,Frecciarossa,2025-11-14 10:04:00,2025-11-14 13:04:00,22,49
330,IRYO_14-11-2025-10.04,04104,04040,IRYO,Frecciarossa,2025-11-14 10:37:00,2025-11-14 11:34:00,12,38
331,IRYO_14-11-2025-10.04,04104,60000,IRYO,Frecciarossa,2025-11-14 10:37:00,2025-11-14 13:04:00,18,56
332,IRYO_14-11-2025-10.04,04040,60000,IRYO,Frecciarossa,2025-11-14 11:37:00,2025-11-14 13:04:00,17,50
333,IRYO_14-11-2025-13.04,71801,60000,IRYO,Frecciarossa,2025-11-14 13:04:00,2025-11-14 15:34:00,17,60
334,IRYO_14-11-2025-17.04,71801,60000,IRYO,Frecciarossa,2025-11-14 17:04:00,2025-11-14 19:34:00,18,52
335,IRYO_14-11-2025-20.55,71801,60000,IRYO,Frecciarossa,2025-11-14 20:55:00,2025-11-14 23:25:00,15,50
336,IRYO_15-11-2025-06.05,60000,71801,IRYO,Frecciarossa,2025-11-15 06:05:00,2025-11-15 08:35:00,22,57
337,IRYO_15-11-2025-07.30,60000,04040,IRYO,Frecciarossa,2025-11-15 07:30:00,2025-11-15 08:50:00,25,53
338,IRYO_15-11-2025-07.30,60000,71801,IRYO,Frecciarossa,2025-11-15 07:30:00,2025-11-15 10:25:00,32,62
339,IRYO_15-11-2025-07.30,04040,71801,IRYO,Frecciarossa,2025-11-15 08:53:00,2025-11-15 10:25:00,23,58
340,IRYO_15-11-2025-10.35,60000,71801,IRYO,Frecciarossa,2025-11-15 10:35:00,2025-11-15 13:05:00,20,50
341,IRYO_15-11-2025-14.35,60000,04040,IRYO,Frecciarossa,2025-11-15 14:35:00,2025-11-15 15:55:00,25,64
342,IRYO_15-11-2025-14.35,60000,04104,IRYO,Frecciarossa,2025-11-15 14:35:00,2025-11-15 16:55:00,18,44
343,IRYO_15-11-2025-14.35,60000,71801,IRYO,Frecciarossa,2025-11-15 14:35:00,2025-11-15 17:35:00,30,74
344,IRYO_15-11-2025-14.35,04040,04104,IRYO,Frecciarossa,2025-11-15 15:58:00,2025-11-15 16:55:00,13,42
345,IRYO_15-11-2025-14.35,04040,71801,IRYO,Frecciarossa,2025-11-15 15:58:00,2025-11-15 17:35:00,24,53
346,IRYO_15-11-2025-14.35,04104,71801,IRYO,Frecciarossa,2025-11-15 16:58:00,2025-11-15 17:35:00,18,62
347,IRYO_15-11-2025-20.35,60000,71801,IRYO,Frecciarossa,2025-11-15 20:35:00,2025-11-15 23:05:00,18,44
348,IRYO_15-11-2025-06.04,71801,04040,IRYO,Frecciarossa,2025-11-15 06:04:00,2025-11-15 07:19:00,16,57
349,IRYO_15-11-2025-06.04,71801,60000,IRYO,Frecciarossa,2025-11-15 06:04:00,2025-11-15 08:59:00,33,64
350,IRYO_15-11-2025-06.04,04040,60000,IRYO,Frecciarossa,2025-11-15 07:22:00,2025-11-15 08:59:00,17,47
351,IRYO_15-11-2025-10.04,71801,04104,IRYO,Frecciarossa,2025-11-15 10:04:00,2025-11-15 10:34:00,17,49
352,IRYO_15-11-2025-10.04,71801,04040,IRYO,Frecciarossa,2025-11-15 10:04:00,2025-11-15 11:34:00,16,53
353,IRYO_15-11-2025-10.04,71801,60000,IRYO,Frecciarossa,2025-11-15 10:04:00,2025-11-15 13:04:00,22,49
354,IRYO_15-11-2025-10.04,04104,04040,IRYO,Frecciarossa,2025-11-15 10:37:00,2025-11-15 11:34:00,12,38
355,IRYO_15-11-2025-10.04,04104,60000,IRYO,Frecciarossa,2025-11-15 10:37:00,2025-11-15 13:04:00,18,56
356,IRYO_15-11-2025-10.04,04040,60000,IRYO,Frecciarossa,2025-11-15 11:37:00,2025-11-15 13:04:00,17,50
357,IRYO_15-11-2025-13.04,71801,60000,IRYO,Frecciarossa,2025-11-15 13:04:00,2025-11-15 15:34:00,17,60
358,IRYO_15-11-2025-17.04,71801,60000,IRYO,Frecciarossa,2025-11-15 17:04:00,2025-11-15 19:34:00,18,52
359,IRYO_15-11-2025-20.55,71801,60000,IRYO,Frecciarossa,2025-11-15 20:55:00,2025-11-15 23:25:00,15,50
360,IRYO_16-11-2025-06.05,60000,71801,IRYO,Frecciarossa,2025-11-16 06:05:00,2025-11-16 08:35:00,22,57
361,IRYO_16-11-2025-07.30,60000,04040,IRYO,Frecciarossa,2025-11-16 07:30:00,2025-11-16 08:50:00,25,53
362,IRYO_16-11-2025-07.30,60000,71801,IRYO,Frecciarossa,2025-11-16 07:30:00,2025-11-16 10:25:00,32,62
363,IRYO_16-11-2025-07.30,04040,71801,IRYO,Frecciarossa,2025-11-16 08:53:00,2025-11-16 10:25:00,23,58
364,IRYO_16-11-2025-10.35,60000,71801,IRYO,Frecciarossa,2025-11-16 10:35:00,2025-11-16 13:05:00,20,50
365,IRYO_16-11-2025-14.35,60000,04040,IRYO,Frecciarossa,2025-11-16 14:35:00,2025-11-16 15:55:00,25,64
366,IRYO_16-11-2025-14.35,60000,04104,IRYO,Frecciarossa,2025-11-16 14:35:00,2025-11-16 16:55:00,18,44
367,IRYO_16-11-2025-14.35,60000,71801,IRYO,Frecciarossa,2025-11-16 14:35:00,2025-11-16 17:35:00,30,74
368,IRYO_16-11-2025-14.35,04040,04104,IRYO,Frecciarossa,2025-11-16 15:58:00,2025-11-16 16:55:00,13,42
369,IRYO_16-11-2025-14.35,04040,71801,IRYO,Frecciarossa,2025-11-16 15:58:00,2025-11-16 17:35:00,24,53
370,IRYO_16-11-2025-14.35,04104,71801,IRYO,Frecciarossa,2025-11-16 16:58:00,2025-11-16 17:35:00,18,62
371,IRYO_16-11-2025-20.35,60000,71801,IRYO,Frecciarossa,2025-11-16 20:35:00,2025-11-16 23:05:00,18,44
372,IRYO_16-11-2025-06.04,71801,04040,IRYO,Frecciarossa,2025-11-16 06:04:00,2025-11-16 07:19:00,16,57
373,IRYO_16-11-2025-06.04,71801,60000,IRYO,Frecciarossa,2025-11-16 06:04:00,2025-11-16 08:59:00,33,64
374,IRYO_16-11-2025-06.04,04040,60000,IRYO,Frecciarossa,2025-11-16 07:22:00,2025-11-16 08:59:00,17,47
375,IRYO_16-11-2025-10.04,71801,04104,IRYO,Frecciarossa,2025-11-16 10:04:00,2025-11-16 10:34:00,17,49
376,IRYO_16-11-2025-10.04,71801,04040,IRYO,Frecciarossa,2025-11-16 10:04:00,2025-11-16 11:34:00,16,53
377,IRYO_16-11-2025-10.04,71801,60000,IRYO,Frecciarossa,2025-11-16 10:04:00,2025-11-16 13:04:00,22,49
378,IRYO_16-11-2025-10.04,04104,04040,IRYO,Frecciarossa,2025-11-16 10:37:00,2025-11-16 11:34:00,12,38
379,IRYO_16-11-2025-10.04,04104,60000,IRYO,Frecciarossa,2025-11-16 10:37:00,2025-11-16 13:04:00,18,56
380,IRYO_16-11-2025-10.04,04040,60000,IRYO,Frecciarossa,2025-11-16 11:37:00,2025-11-16 13:04:00,17,50
381,IRYO_16-11-2025-13.04,71801,60000,IRYO,Frecciarossa,2025-11-16 13:04:00,2025-11-16 15:34:00,17,60
382,IRYO_16-11-2025-17.04,71801,60000,IRYO,Frecciarossa,2025-11-16 17:04:00,2025-11-16 19:34:00,18,52
383,IRYO_16-11-2025-20.55,71801,60000,IRYO,Frecciarossa,2025-11-16 20:55:00,2025-11-16 23:25:00,15,50
384,IRYO_17-11-2025-06.05,60000,71801,IRYO,Frecciarossa,2025-11-17 06:05:00,2025-11-17 08:35:00,22,57
385,IRYO_17-11-2025-07.30,60000,04040,IRYO,Frecciarossa,2025-11-17 07:30:00,2025-11-17 08:50:00,25,53
386,IRYO_17-11-2025-07.30,60000,71801,IRYO,Frecciarossa,2025-11-17 07:30:00,2025-11-17 10:25:00,32,62
387,IRYO_17-11-2025-07.30,04040,71801,IRYO,Frecciarossa,2025-11-17 08:53:00,2025-11-17 10:25:00,23,58
388,IRYO_17-11-2025-10.35,60000,71801,IRYO,Frecciarossa,2025-11-17 10:35:00,2025-11-17 13:05:00,20,50
389,IRYO_17-11-2025-14.35,60000,04040,IRYO,Frecciarossa,2025-11-17 14:35:00,2025-11-17 15:55:00,25,64
390,IRYO_17-11-2025-14.35,60000,04104,IRYO,Frecciarossa,2025-11-17 14:35:00,2025-11-17 16:55:00,18,44
391,IRYO_17-11-2025-14.35,60000,71801,IRYO,Frecciarossa,2025-11-17 14:35:00,2025-11-17 17:35:00,30,74
392,IRYO_17-11-2025-14.35,04040,04104,IRYO,Frecciarossa,2025-11-17 15:58:00,2025-11-17 16:55:00,13,42
393,IRYO_17-11-2025-14.35,04040,71801,IRYO,Frecciarossa,2025-11-17 15:58:00,2025-11-17 17:35:00,24,53
394,IRYO_17-11-2025-14.35,04104,71801,IRYO,Frecciarossa,2025-11-17 16:58:00,2025-11-17 17:35:00,18,62
395,IRYO_17-11-2025-20.35,60000,71801,IRYO,Frecciarossa,2025-11-17 20:35:00,2025-11-17 23:05:00,18,44
396,IRYO_17-11-2025-06.04,71801,04040,IRYO,Frecciarossa,2025-11-17 06:04:00,2025-11-17 07:19:00,16,57
397,IRYO_17-11-2025-06.04,71801,60000,IRYO,Frecciarossa,2025-11-17 06:04:00,2025-11-17 08:59:00,33,64
398,IRYO_17-11-2025-06.04,04040,60000,IRYO,Frecciarossa,2025-11-17 07:22:00,2025-11-17 08:59:00,17,47
399,IRYO_17-11-2025-10.04,71801,04104,IRYO,Frecciarossa,2025-11-17 10:04:00,2025-11-17 10:34:00,17,49
400,IRYO_17-11-2025-10.04,71801,04040,IRYO,Frecciarossa,2025-11-17 10:04:00,2025-11-17 11:34:00,16,53
401,IRYO_17-11-2025-10.04,71801,60000,IRYO,Frecciarossa,2025-11-17 10:04:00,2025-11-17 13:04:00,22,49
402,IRYO_17-11-2025-10.04,04104,04040,IRYO,Frecciarossa,2025-11-17 10:37:00,2025-11-17 11:34:00,12,38
403,IRYO_17-11-2025-10.04,04104,60000,IRYO,Frecciarossa,2025-11-17 10:37:00,2025-11-17 13:04:00,18,56
404,IRYO_17-11-2025-10.04,04040,60000,IRYO,Frecciarossa,2025-11-17 11:37:00,2025-11-17 13:04:00,17,50
405,IRYO_17-11-2025-13.04,71801,60000,IRYO,Frecciarossa,2025-11-17 13:04:00,2025-11-17 15:34:00,17,60
406,IRYO_17-11-2025-17.04,71801,60000,IRYO,Frecciarossa,2025-11-17 17:04:00,2025-11-17 19:34:00,18,52
407,IRYO_17-11-2025-20.55,71801,60000,IRYO,Frecciarossa,2025-11-17 20:55:00,2025-11-17 23:25:00,15,50
408,IRYO_18-11-2025-06.05,60000,71801,IRYO,Frecciarossa,2025-11-18 06:05:00,2025-11-18 08:35:00,22,57
409,IRYO_18-11-2025-07.30,60000,04040,IRYO,Frecciarossa,2025-11-18 07:30:00,2025-11-18 08:50:00,25,53
410,IRYO_18-11-2025-07.30,60000,71801,IRYO,Frecciarossa,2025-11-18 07:30:00,2025-11-18 10:25:00,32,62
411,IRYO_18-11-2025-07.30,04040,71801,IRYO,Frecciarossa,2025-11-18 08:53:00,2025-11-18 10:25:00,23,58
412,IRYO_18-11-2025-10.35,60000,71801,IRYO,Frecciarossa,2025-11-18 10:35:00,2025-11-18 13:05:00,20,50
413,IRYO_18-11-2025-14.35,60000,04040,IRYO,Frecciarossa,2025-11-18 14:35:00,2025-11-18 15:55:00,25,64
414,IRYO_18-11-2025-14.35,60000,04104,IRYO,Frecciarossa,2025-11-18 14:35:00,2025-11-18 16:55:00,18,44
415,IRYO_18-11-2025-14.35,60000,71801,IRYO,Frecciarossa,2025-11-18 14:35:00,2025-11-18 17:35:00,30,74
416,IRYO_18-11-2025-14.35,04040,04104,IRYO,Frecciarossa,2025-11-18 15:58:00,2025-11-18 16:55:00,13,42
417,IRYO_18-11-2025-14.35,04040,71801,IRYO,Frecciarossa,2025-11-18 15:58:00,2025-11-18 17:35:00,24,53
418,IRYO_18-11-2025-14.35,04104,71801,IRYO,Frecciarossa,2025-11-18 16:58:00,2025-11-18 17:35:00,18,62
419,IRYO_18-11-2025-20.35,60000,71801,IRYO,Frecciarossa,2025-11-18 20:35:00,2025-11-18 23:05:00,18,44
420,IRYO_18-11-2025-06.04,71801,04040,IRYO,Frecciarossa,2025-11-18 06:04:00,2025-11-18 07:19:00,16,57
421,IRYO_18-11-2025-06.04,71801,60000,IRYO,Frecciarossa,2025-11-18 06:04:00,2025-11-18 08:59:00,33,64
422,IRYO_18-11-2025-06.04,04040,60000,IRYO,Frecciarossa,2025-11-18 07:22:00,2025-11-18 08:59:00,17,47
423,IRYO_18-11-2025-10.04,71801,04104,IRYO,Frecciarossa,2025-11-18 10:04:00,2025-11-18 10:34:00,17,49
424,IRYO_18-11-2025-10.04,71801,04040,IRYO,Frecciarossa,2025-11-18 10:04:00,2025-11-18 11:34:00,16,53
425,IRYO_18-11-2025-10.04,71801,60000,IRYO,Frecciarossa,2025-11-18 10:04:00,2025-11-18 13:04:00,22,49
426,IRYO_18-11-2025-10.04,04104,04040,IRYO,Frecciarossa,2025-11-18 10:37:00,2025-11-18 11:34:00,12,38
427,IRYO_18-11-2025-10.04,04104,60000,IRYO,Frecciarossa,2025-11-18 10:37:00,2025-11-18 13:04:00,18,56
428,IRYO_18-11-2025-10.04,04040,60000,IRYO,Frecciarossa,2025-11-18 11:37:00,2025-11-18 13:04:00,17,50
429,IRYO_18-11-2025-13.04,71801,60000,IRYO,Frecciarossa,2025-11-18 13:04:00,2025-11-18 15:34:00,17,60
430,IRYO_18-11-2025-17.04,71801,60000,IRYO,Frecciarossa,2025-11-18 17:04:00,2025-11-18 19:34:00,18,52
431,IRYO_18-11-2025-20.55,71801,60000,IRYO,Frecciarossa,2025-11-18 20:55:00,2025-11-18 23:25:00,15,50
432,IRYO_19-11-2025-06.05,60000,71801,IRYO,Frecciarossa,2025-11-19 06:05:00,2025-11-19 08:35:00,22,57
433,IRYO_19-11-2025-07.30,60000,04040,IRYO,Frecciarossa,2025-11-19 07:30:00,2025-11-19 08:50:00,25,53
434,IRYO_19-11-2025-07.30,60000,71801,IRYO,Frecciarossa,2025-11-19 07:30:00,2025-11-19 10:25:00,32,62
435,IRYO_19-11-2025-07.30,04040,71801,IRYO,Frecciarossa,2025-11-19 08:53:00,2025-11-19 10:25:00,23,58
436,IRYO_19-11-2025-10.35,60000,71801,IRYO,Frecciarossa,2025-11-19 10:35:00,2025-11-19 13:05:00,20,50
437,IRYO_19-11-2025-14.35,60000,04040,IRYO,Frecciarossa,2025-11-19 14:35:00,2025-11-19 15:55:00,25,64
438,IRYO_19-11-2025-14.35,60000,04104,IRYO,Frecciarossa,2025-11-19 14:35:00,2025-11-19 16:55:00,18,44
439,IRYO_19-11-2025-14.35,60000,71801,IRYO,Frecciarossa,2025-11-19 14:35:00,2025-11-19 17:35:00,30,74
440,IRYO_19-11-2025-14.35,04040,04104,IRYO,Frecciarossa,2025-11-19 15:58:00,2025-11-19 16:55:00,13,42
441,IRYO_19-11-2025-14.35,04040,71801,IRYO,Frecciarossa,2025-11-19 15:58:00,2025-11-19 17:35:00,24,53
442,IRYO_19-11-2025-14.35,04104,71801,IRYO,Frecciarossa,2025-11-19 16:58:00,2025-11-19 17:35:00,18,62
443,IRYO_19-11-2025-20.35,60000,71801,IRYO,Frecciarossa,2025-11-19 20:35:00,2025-11-19 23:05:00,18,44
444,IRYO_19-11-2025-06.04,71801,04040,IRYO,Frecciarossa,2025-11-19 06:04:00,2025-11-19 07:19:00,16,57
445,IRYO_19-11-2025-06.04,71801,60000,IRYO,Frecciarossa,2025-11-19 06:04:00,2025-11-19 08:59:00,33,64
446,IRYO_19-11-2025-06.04,04040,60000,IRYO,Frecciarossa,2025-11-19 07:22:00,2025-11-19 08:59:00,17,47
447,IRYO_19-11-2025-10.04,71801,04104,IRYO,Frecciarossa,2025-11-19 10:04:00,2025-11-19 10:34:00,17,49
448,IRYO_19-11-2025-10.04,71801,04040,IRYO,Frecciarossa,2025-11-19 10:04:00,2025-11-19 11:34:00,16,53
449,IRYO_19-11-2025-10.04,71801,60000,IRYO,Frecciarossa,2025-11-19 10:04:00,2025-11-19 13:04:00,22,49
450,IRYO_19-11-2025-10.04,04104,04040,IRYO,Frecciarossa,2025-11-19 10:37:00,2025-11-19 11:34:00,12,38
451,IRYO_19-11-2025-10.04,04104,60000,IRYO,Frecciarossa,2025-11-19 10:37:00,2025-11-19 13:04:00,18,56
452,IRYO_19-11-2025-10.04,04040,60000,IRYO,Frecciarossa,2025-11-19 11:37:00,2025-11-19 13:04:00,17,50
453,IRYO_19-11-2025-13.04,71801,60000,IRYO,Frecciarossa,2025-11-19 13:04:00,2025-11-19 15:34:00,17,60
454,IRYO_19-11-2025-17.04,71801,60000,IRYO,Frecciarossa,2025-11-19 17:04:00,2025-11-19 19:34:00,18,52
455,IRYO_19-11-2025-20.55,71801,60000,IRYO,Frecciarossa,2025-11-19 20:55:00,2025-11-19 23:25:00,15,50
456,IRYO_20-11-2025-06.05,60000,71801,IRYO,Frecciarossa,2025-11-20 06:05:00,2025-11-20 08:35:00,22,57
457,IRYO_20-11-2025-07.30,60000,04040,IRYO,Frecciarossa,2025-11-20 07:30:00,2025-11-20 08:50:00,25,53
458,IRYO_20-11-2025-07.30,60000,71801,IRYO,Frecciarossa,2025-11-20 07:30:00,2025-11-20 10:25:00,32,62
459,IRYO_20-11-2025-07.30,04040,71801,IRYO,Frecciarossa,2025-11-20 08:53:00,2025-11-20 10:25:00,23,58
460,IRYO_20-11-2025-10.35,60000,71801,IRYO,Frecciarossa,2025-11-20 10:35:00,2025-11-20 13:05:00,20,50
461,IRYO_20-11-2025-14.35,60000,04040,IRYO,Frecciarossa,2025-11-20 14:35:00,2025-11-20 15:55:00,25,64
462,IRYO_20-11-2025-14.35,60000,04104,IRYO,Frecciarossa,2025-11-20 14:35:00,2025-11-20 16:55:00,18,44
463,IRYO_20-11-2025-14.35,60000,71801,IRYO,Frecciarossa,2025-11-20 14:35:00,2025-11-20 17:35:00,30,74
464,IRYO_20-11-2025-14.35,04040,04104,IRYO,Frecciarossa,2025-11-20 15:58:00,2025-11-20 16:55:00,13,42
465,IRYO_20-11-2025-14.35,04040,71801,IRYO,Frecciarossa,2025-11-20 15:58:00,2025-11-20 17:35:00,24,53
466,IRYO_20-11-2025-14.35,04104,71801,IRYO,Frecciarossa,2025-11-20 16:58:00,2025-11-20 17:35:00,18,62
467,IRYO_20-11-2025-20.35,60000,71801,IRYO,Frecciarossa,2025-11-20 20:35:00,2025-11-20 23:05:00,18,44
468,IRYO_20-11-2025-06.04,71801,04040,IRYO,Frecciarossa,2025-11-20 06:04:00,2025-11-20 07:19:00,16,57
469,IRYO_20-11-2025-06.04,71801,60000,IRYO,Frecciarossa,2025-11-20 06:04:00,2025-11-20 08:59:00,33,64
470,IRYO_20-11-2025-06.04,04040,60000,IRYO,Frecciarossa,2025-11-20 07:22:00,2025-11-20 08:59:00,17,47
471,IRYO_20-11-2025-10.04,71801,04104,IRYO,Frecciarossa,2025-11-20 10:04:00,2025-11-20 10:34:00,17,49
472,IRYO_20-11-2025-10.04,71801,04040,IRYO,Frecciarossa,2025-11-20 10:04:00,2025-11-20 11:34:00,16,53
473,IRYO_20-11-2025-10.04,71801,60000,IRYO,Frecciarossa,2025-11-20 10:04:00,2025-11-20 13:04:00,22,49
474,IRYO_20-11-2025-10.04,04104,04040,IRYO,Frecciarossa,2025-11-20 10:37:00,2025-11-20 11:34:00,12,38
475,IRYO_20-11-2025-10.04,04104,60000,IRYO,Frecciarossa,2025-11-20 10:37:00,2025-11-20 13:04:00,18,56
476,IRYO_20-11-2025-10.04,04040,60000,IRYO,Frecciarossa,2025-11-20 11:37:00,2025-11-20 13:04:00,17,50
477,IRYO_20-11-2025-13.04,71801,60000,IRYO,Frecciarossa,2025-11-20 13:04:00,2025-11-20 15:34:00,17,60
478,IRYO_20-11-2025-17.04,71801,60000,IRYO,Frecciarossa,2025-11-20 17:04:00,2025-11-20 19:34:00,18,52
479,IRYO_20-11-2025-20.55,71801,60000,IRYO,Frecciarossa,2025-11-20 20:55:00,2025-11-20 23:25:00,15,50
480,IRYO_21-11-2025-06.05,60000,71801,IRYO,Frecciarossa,2025-11-21 06:05:00,2025-11-21 08:35:00,22,57
481,IRYO_21-11-2025-07.30,60000,04040,IRYO,Frecciarossa,2025-11-21 07:30:00,2025-11-21 08:50:00,25,53
482,IRYO_21-11-2025-07.30,60000,71801,IRYO,Frecciarossa,2025-11-21 07:30:00,2025-11-21 10:25:00,32,62
483,IRYO_21-11-2025-07.30,04040,71801,IRYO,Frecciarossa,2025-11-21 08:53:00,2025-11-21 10:25:00,23,58
484,IRYO_21-11-2025-10.35,60000,71801,IRYO,Frecciarossa,2025-11-21 10:35:00,2025-11-21 13:05:00,20,50
485,IRYO_21-11-2025-14.35,60000,04040,IRYO,Frecciarossa,2025-11-21 14:35:00,2025-11-21 15:55:00,25,64
486,IRYO_21-11-2025-14.35,60000,04104,IRYO,Frecciarossa,2025-11-21 14:35:00,2025-11-21 16:55:00,18,44
487,IRYO_21-11-2025-14.35,60000,71801,IRYO,Frecciarossa,2025-11-21 14:35:00,2025-11-21 17:35:00,30,74
488,IRYO_21-11-2025-14.35,04040,04104,IRYO,Frecciarossa,2025-11-21 15:58:00,2025-11-21 16:55:00,13,42
489,IRYO_21-11-2025-14.35,04040,71801,IRYO,Frecciarossa,2025-11-21 15:58:00,2025-11-21 17:35:00,24,53
490,IRYO_21-11-2025-14.35,04104,71801,IRYO,Frecciarossa,2025-11-21 16:58:00,2025-11-21 17:35:00,18,62
491,IRYO_21-11-2025-20.35,60000,71801,IRYO,Frecciarossa,2025-11-21 20:35:00,2025-11-21 23:05:00,18,44
492,IRYO_21-11-2025-06.04,71801,04040,IRYO,Frecciarossa,2025-11-21 06:04:00,2025-11-21 07:19:00,16,57
493,IRYO_21-11-2025-06.04,71801,60000,IRYO,Frecciarossa,2025-11-21 06:04:00,2025-11-21 08:59:00,33,64
494,IRYO_21-11-2025-06.04,04040,60000,IRYO,Frecciarossa,2025-11-21 07:22:00,2025-11-21 08:59:00,17,47
495,IRYO_21-11-2025-10.04,71801,04104,IRYO,Frecciarossa,2025-11-21 10:04:00,2025-11-21 10:34:00,17,49
496,IRYO_21-11-2025-10.04,71801,04040,IRYO,Frecciarossa,2025-11-21 10:04:00,2025-11-21 11:34:00,16,53
497,IRYO_21-11-2025-10.04,71801,60000,IRYO,Frecciarossa,2025-11-21 10:04:00,2025-11-21 13:04:00,22,49
498,IRYO_21-11-2025-10.04,04104,04040,IRYO,Frecciarossa,2025-11-21 10:37:00,2025-11-21 11:34:00,12,38
499,IRYO_21-11-2025-10.04,04104,60000,IRYO,Frecciarossa,2025-11-21 10:37:00,2025-11-21 13:04:00,18,56
500,IRYO_21-11-2025-10.04,04040,60000,IRYO,Frecciarossa,2025-11-21 11:37:00,2025-11-21 13:04:00,17,50
501,IRYO_21-11-2025-13.04,71801,60000,IRYO,Frecciarossa,2025-11-21 13:04:00,2025-11-21 15:34:00,17,60
502,IRYO_21-11-2025-17.04,71801,60000,IRYO,Frecciarossa,2025-11-21 17:04:00,2025-11-21 19:34:00,18,52
503,IRYO_21-11-2025-20.55,71801,60000,IRYO,Frecciarossa,2025-11-21 20:55:00,2025-11-21 23:25:00,15,50
504,IRYO_22-11-2025-06.05,60000,71801,IRYO,Frecciarossa,2025-11-22 06:05:00,2025-11-22 08:35:00,22,57
505,IRYO_22-11-2025-07.30,60000,04040,IRYO,Frecciarossa,2025-11-22 07:30:00,2025-11-22 08:50:00,25,53
506,IRYO_22-11-2025-07.30,60000,71801,IRYO,Frecciarossa,2025-11-22 07:30:00,2025-11-22 10:25:00,32,62
507,IRYO_22-11-2025-07.30,04040,71801,IRYO,Frecciarossa,2025-11-22 08:53:00,2025-11-22 10:25:00,23,58
508,IRYO_22-11-2025-10.35,60000,71801,IRYO,Frecciarossa,2025-11-22 10:35:00,2025-11-22 13:05:00,20,50
509,IRYO_22-11-2025-14.35,60000,04040,IRYO,Frecciarossa,2025-11-22 14:35:00,2025-11-22 15:55:00,25,64
510,IRYO_22-11-2025-14.35,60000,04104,IRYO,Frecciarossa,2025-11-22 14:35:00,2025-11-22 16:55:00,18,44
511,IRYO_22-11-2025-14.35,60000,71801,IRYO,Frecciarossa,2025-11-22 14:35:00,2025-11-22 17:35:00,30,74
512,IRYO_22-11-2025-14.35,04040,04104,IRYO,Frecciarossa,2025-11-22 15:58:00,2025-11-22 16:55:00,13,42
513,IRYO_22-11-2025-14.35,04040,71801,IRYO,Frecciarossa,2025-11-22 15:58:00,2025-11-22 17:35:00,24,53
514,IRYO_22-11-2025-14.35,04104,71801,IRYO,Frecciarossa,2025-11-22 16:58:00,2025-11-22 17:35:00,18,62
515,IRYO_22-11-2025-20.35,60000,71801,IRYO,Frecciarossa,2025-11-22 20:35:00,2025-11-22 23:05:00,18,44
516,IRYO_22-11-2025-06.04,71801,04040,IRYO,Frecciarossa,2025-11-22 06:04:00,2025-11-22 07:19:00,16,57
517,IRYO_22-11-2025-06.04,71801,60000,IRYO,Frecciarossa,2025-11-22 06:04:00,2025-11-22 08:59:00,33,64
518,IRYO_22-11-2025-06.04,04040,60000,IRYO,Frecciarossa,2025-11-22 07:22:00,2025-11-22 08:59:00,17,47
519,IRYO_22-11-2025-10.04,71801,04104,IRYO,Frecciarossa,2025-11-22 10:04:00,2025-11-22 10:34:00,17,49
520,IRYO_22-11-2025-10.04,71801,04040,IRYO,Frecciarossa,2025-11-22 10:04:00,2025-11-22 11:34:00,16,53
521,IRYO_22-11-2025-10.04,71801,60000,IRYO,Frecciarossa,2025-11-22 10:04:00,2025-11-22 13:04:00,22,49
522,IRYO_22-11-2025-10.04,04104,04040,IRYO,Frecciarossa,2025-11-22 10:37:00,2025-11-22 11:34:00,12,38
523,IRYO_22-11-2025-10.04,04104,60000,IRYO,Frecciarossa,2025-11-22 10:37:00,2025-11-22 13:04:00,18,56
524,IRYO_22-11-2025-10.04,04040,60000,IRYO,Frecciarossa,2025-11-22 11:37:00,2025-11-22 13:04:00,17,50
525,IRYO_22-11-2025-13.04,71801,60000,IRYO,Frecciarossa,2025-11-22 13:04:00,2025-11-22 15:34:00,17,60
526,IRYO_22-11-2025-17.04,71801,60000,IRYO,Frecciarossa,2025-11-22 17:04:00,2025-11-22 19:34:00,18,52
527,IRYO_22-11-2025-20.55,71801,60000,IRYO,Frecciarossa,2025-11-22 20:55:00,2025-11-22 23:25:00,15,50
528,IRYO_23-11-2025-06.05,60000,71801,IRYO,Frecciarossa,2025-11-23 06:05:00,2025-11-23 08:35:00,22,57
529,IRYO_23-11-2025-07.30,60000,04040,IRYO,Frecciarossa,2025-11-23 07:30:00,2025-11-23 08:50:00,25,53
530,IRYO_23-11-2025-07.30,60000,71801,IRYO,Frecciarossa,2025-11-23 07:30:00,2025-11-23 10:25:00,32,62
531,IRYO_23-11-2025-07.30,04040,71801,IRYO,Frecciarossa,2025-11-23 08:53:00,2025-11-23 10:25:00,23,58
532,IRYO_23-11-2025-10.35,60000,71801,IRYO,Frecciarossa,2025-11-23 10:35:00,2025-11-23 13:05:00,20,50
533,IRYO_23-11-2025-14.35,60000,04040,IRYO,Frecciarossa,2025-11-23 14:35:00,2025-11-23 15:55:00,25,64
534,IRYO_23-11-2025-14.35,60000,04104,IRYO,Frecciarossa,2025-11-23 14:35:00,2025-11-23 16:55:00,18,44
535,IRYO_23-11-2025-14.35,60000,71801,IRYO,Frecciarossa,2025-11-23 14:35:00,2025-11-23 17:35:00,30,74
536,IRYO_23-11-2025-14.35,04040,04104,IRYO,Frecciarossa,2025-11-23 15:58:00,2025-11-23 16:55:00,13,42
537,IRYO_23-11-2025-14.35,04040,71801,IRYO,Frecciarossa,2025-11-23 15:58:00,2025-11-23 17:35:00,24,53
538,IRYO_23-11-2025-14.35,04104,71801,IRYO,Frecciarossa,2025-11-23 16:58:00,2025-11-23 17:35:00,18,62
539,IRYO_23-11-2025-20.35,60000,71801,IRYO,Frecciarossa,2025-11-23 20:35:00,2025-11-23 23:05:00,18,44
540,IRYO_23-11-2025-06.04,71801,04040,IRYO,Frecciarossa,2025-11-23 06:04:00,2025-11-23 07:19:00,16,57
541,IRYO_23-11-2025-06.04,71801,60000,IRYO,Frecciarossa,2025-11-23 06:04:00,2025-11-23 08:59:00,33,64
542,IRYO_23-11-2025-06.04,04040,60000,IRYO,Frecciarossa,2025-11-23 07:22:00,2025-11-23 08:59:00,17,47
543,IRYO_23-11-2025-10.04,71801,04104,IRYO,Frecciarossa,2025-11-23 10:04:00,2025-11-23 10:34:00,17,49
544,IRYO_23-11-2025-10.04,71801,04040,IRYO,Frecciarossa,2025-11-23 10:04:00,2025-11-23 11:34:00,16,53
545,IRYO_23-11-2025-10.04,71801,60000,IRYO,Frecciarossa,2025-11-23 10:04:00,2025-11-23 13:04:00,22,49
546,IRYO_23-11-2025-10.04,04104,04040,IRYO,Frecciarossa,2025-11-23 10:37:00,2025-11-23 11:34:00,12,38
547,IRYO_23-11-2025-10.04,04104,60000,IRYO,Frecciarossa,2025-11-23 10:37:00,2025-11-23 13:04:00,18,56
548,IRYO_23-11-2025-10.04,04040,60000,IRYO,Frecciarossa,2025-11-23 11:37:00,2025-11-23 13:04:00,17,50
549,IRYO_23-11-2025-13.04,71801,60000,IRYO,Frecciarossa,2025-11-23 13:04:00,2025-11-23 15:34:00,17,60
550,IRYO_23-11-2025-17.04,71801,60000,IRYO,Frecciarossa,2025-11-23 17:04:00,2025-11-23 19:34:00,18,52
551,IRYO_23-11-2025-20.55,71801,60000,IRYO,Frecciarossa,2025-11-23 20:55:00,2025-11-23 23:25:00,15,50
552,IRYO_24-11-2025-06.05,60000,71801,IRYO,Frecciarossa,2025-11-24 06:05:00,2025-11-24 08:35:00,22,57
553,IRYO_24-11-2025-07.30,60000,04040,IRYO,Frecciarossa,2025-11-24 07:30:00,2025-11-24 08:50:00,25,53
554,IRYO_24-11-2025-07.30,60000,71801,IRYO,Frecciarossa,2025-11-24 07:30:00,2025-11-24 10:25:00,32,62
555,IRYO_24-11-2025-07.30,04040,71801,IRYO,Frecciarossa,2025-11-24 08:53:00,2025-11-24 10:25:00,23,58
556,IRYO_24-11-2025-10.35,60000,71801,IRYO,Frecciarossa,2025-11-24 10:35:00,2025-11-24 13:05:00,20,50
557,IRYO_24-11-2025-14.35,60000,04040,IRYO,Frecciarossa,2025-11-24 14:35:00,2025-11-24 15:55:00,25,64
558,IRYO_24-11-2025-14.35,60000,04104,IRYO,Frecciarossa,2025-11-24 14:35:00,2025-11-24 16:55:00,18,44
559,IRYO_24-11-2025-14.35,60000,71801,IRYO,Frecciarossa,2025-11-24 14:35:00,2025-11-24 17:35:00,30,74
560,IRYO_24-11-2025-14.35,04040,04104,IRYO,Frecciarossa,2025-11-24 15:58:00,2025-11-24 16:55:00,13,42
561,IRYO_24-11-2025-14.35,04040,71801,IRYO,Frecciarossa,2025-11-24 15:58:00,2025-11-24 17:35:00,24,53
562,IRYO_24-11-2025-14.35,04104,71801,IRYO,Frecciarossa,2025-11-24 16:58:00,2025-11-24 17:35:00,18,62
563,IRYO_24-11-2025-20.35,60000,71801,IRYO,Frecciarossa,2025-11-24 20:35:00,2025-11-24 23:05:00,18,44
564,IRYO_24-11-2025-06.04,71801,04040,IRYO,Frecciarossa,2025-11-24 06:04:00,2025-11-24 07:19:00,16,57
565,IRYO_24-11-2025-06.04,71801,60000,IRYO,Frecciarossa,2025-11-24 06:04:00,2025-11-24 08:59:00,33,64
566,IRYO_24-11-2025-06.04,04040,60000,IRYO,Frecciarossa,2025-11-24 07:22:00,2025-11-24 08:59:00,17,47
567,IRYO_24-11-2025-10.04,71801,04104,IRYO,Frecciarossa,2025-11-24 10:04:00,2025-11-24 10:34:00,17,49
568,IRYO_24-11-2025-10.04,71801,04040,IRYO,Frecciarossa,2025-11-24 10:04:00,2025-11-24 11:34:00,16,53
569,IRYO_24-11-2025-10.04,71801,60000,IRYO,Frecciarossa,2025-11-24 10:04:00,2025-11-24 13:04:00,22,49
570,IRYO_24-11-2025-10.04,04104,04040,IRYO,Frecciarossa,2025-11-24 10:37:00,2025-11-24 11:34:00,12,38
571,IRYO_24-11-2025-10.04,04104,60000,IRYO,Frecciarossa,2025-11-24 10:37:00,2025-11-24 13:04:00,18,56
572,IRYO_24-11-2025-10.04,04040,60000,IRYO,Frecciarossa,2025-11-24 11:37:00,2025-11-24 13:04:00,17,50
573,IRYO_24-11-2025-13.04,71801,60000,IRYO,Frecciarossa,2025-11-24 13:04:00,2025-11-24 15:34:00,17,60
574,IRYO_24-11-2025-17.04,71801,60000,IRYO,Frecciarossa,2025-11-24 17:04:00,2025-11-24 19:34:00,18,52
575,IRYO_24-11-2025-20.55,71801,60000,IRYO,Frecciarossa,2025-11-24 20:55:00,2025-11-24 23:25:00,15,50
576,IRYO_25-11-2025-06.05,60000,71801,IRYO,Frecciarossa,2025-11-25 06:05:00,2025-11-25 08:35:00,22,57
577,IRYO_25-11-2025-07.30,60000,04040,IRYO,Frecciarossa,2025-11-25 07:30:00,2025-11-25 08:50:00,25,53
578,IRYO_25-11-2025-07.30,60000,71801,IRYO,Frecciarossa,2025-11-25 07:30:00,2025-11-25 10:25:00,32,62
579,IRYO_25-11-2025-07.30,04040,71801,IRYO,Frecciarossa,2025-11-25 08:53:00,2025-11-25 10:25:00,23,58
580,IRYO_25-11-2025-10.35,60000,71801,IRYO,Frecciarossa,2025-11-25 10:35:00,2025-11-25 13:05:00,20,50
581,IRYO_25-11-2025-14.35,60000,04040,IRYO,Frecciarossa,2025-11-25 14:35:00,2025-11-25 15:55:00,25,64
582,IRYO_25-11-2025-14.35,60000,04104,IRYO,Frecciarossa,2025-11-25 14:35:00,2025-11-25 16:55:00,18,44
583,IRYO_25-11-2025-14.35,60000,71801,IRYO,Frecciarossa,2025-11-25 14:35:00,2025-11-25 17:35:00,30,74
584,IRYO_25-11-2025-14.35,04040,04104,IRYO,Frecciarossa,2025-11-25 15:58:00,2025-11-25 16:55:00,13,42
585,IRYO_25-11-2025-14.35,04040,71801,IRYO,Frecciarossa,2025-11-25 15:58:00,2025-11-25 17:35:00,24,53
586,IRYO_25-11-2025-14.35,04104,71801,IRYO,Frecciarossa,2025-11-25 16:58:00,2025-11-25 17:35:00,18,62
587,IRYO_25-11-2025-20.35,60000,71801,IRYO,Frecciarossa,2025-11-25 20:35:00,2025-11-25 23:05:00,18,44
588,IRYO_25-11-2025-06.04,71801,04040,IRYO,Frecciarossa,2025-11-25 06:04:00,2025-11-25 07:19:00,16,57
589,IRYO_25-11-2025-06.04,71801,60000,IRYO,Frecciarossa,2025-11-25 06:04:00,2025-11-25 08:59:00,33,64
590,IRYO_25-11-2025-06.04,04040,60000,IRYO,Frecciarossa,2025-11-25 07:22:00,2025-11-25 08:59:00,17,47
591,IRYO_25-11-2025-10.04,71801,04104,IRYO,Frecciarossa,2025-11-25 10:04:00,2025-11-25 10:34:00,17,49
592,IRYO_25-11-2025-10.04,71801,04040,IRYO,Frecciarossa,2025-11-25 10:04:00,2025-11-25 11:34:00,16,53
593,IRYO_25-11-2025-10.04,71801,60000,IRYO,Frecciarossa,2025-11-25 10:04:00,2025-11-25 13:04:00,22,49
594,IRYO_25-11-2025-10.04,04104,04040,IRYO,Frecciarossa,2025-11-25 10:37:00,2025-11-25 11:34:00,12,38
595,IRYO_25-11-2025-10.04,04104,60000,IRYO,Frecciarossa,2025-11-25 10:37:00,2025-11-25 13:04:00,18,56
596,IRYO_25-11-2025-10.04,04040,60000,IRYO,Frecciarossa,2025-11-25 11:37:00,2025-11-25 13:04:00,17,50
597,IRYO_25-11-2025-13.04,71801,60000,IRYO,Frecciarossa,2025-11-25 13:04:00,2025-11-25 15:34:00,17,60
598,IRYO_25-11-2025-17.04,71801,60000,IRYO,Frecciarossa,2025-11-25 17:04:00,2025-11-25 19:34:00,18,52
599,IRYO_25-11-2025-20.55,71801,60000,IRYO,Frecciarossa,2025-11-25 20:55:00,2025-11-25 23:25:00,15,50
600,IRYO_26-11-2025-06.05,60000,71801,IRYO,Frecciarossa,2025-11-26 06:05:00,2025-11-26 08:35:00,22,57
601,IRYO_26-11-2025-07.30,60000,04040,IRYO,Frecciarossa,2025-11-26 07:30:00,2025-11-26 08:50:00,25,53
602,IRYO_26-11-2025-07.30,60000,71801,IRYO,Frecciarossa,2025-11-26 07:30:00,2025-11-26 10:25:00,32,62
603,IRYO_26-11-2025-07.30,04040,71801,IRYO,Frecciarossa,2025-11-26 08:53:00,2025-11-26 10:25:00,23,58
604,IRYO_26-11-2025-10.35,60000,71801,IRYO,Frecciarossa,2025-11-26 10:35:00,2025-11-26 13:05:00,20,50
605,IRYO_26-11-2025-14.35,60000,04040,IRYO,Frecciarossa,2025-11-26 14:35:00,2025-11-26 15:55:00,25,64
606,IRYO_26-11-2025-14.35,60000,04104,IRYO,Frecciarossa,2025-11-26 14:35:00,2025-11-26 16:55:00,18,44
607,IRYO_26-11-2025-14.35,60000,71801,IRYO,Frecciarossa,2025-11-26 14:35:00,2025-11-26 17:35:00,30,74
608,IRYO_26-11-2025-14.35,04040,04104,IRYO,Frecciarossa,2025-11-26 15:58:00,2025-11-26 16:55:00,13,42
609,IRYO_26-11-2025-14.35,04040,71801,IRYO,Frecciarossa,2025-11-26 15:58:00,2025-11-26 17:35:00,24,53
610,IRYO_26-11-2025-14.35,04104,71801,IRYO,Frecciarossa,2025-11-26 16:58:00,2025-11-26 17:35:00,18,62
611,IRYO_26-11-2025-20.35,60000,71801,IRYO,Frecciarossa,2025-11-26 20:35:00,2025-11-26 23:05:00,18,44
612,IRYO_26-11-2025-06.04,71801,04040,IRYO,Frecciarossa,2025-11-26 06:04:00,2025-11-26 07:19:00,16,57
613,IRYO_26-11-2025-06.04,71801,60000,IRYO,Frecciarossa,2025-11-26 06:04:00,2025-11-26 08:59:00,33,64
614,IRYO_26-11-2025-06.04,04040,60000,IRYO,Frecciarossa,2025-11-26 07:22:00,2025-11-26 08:59:00,17,47
615,IRYO_26-11-2025-10.04,71801,04104,IRYO,Frecciarossa,2025-11-26 10:04:00,2025-11-26 10:34:00,17,49
616,IRYO_26-11-2025-10.04,71801,04040,IRYO,Frecciarossa,2025-11-26 10:04:00,2025-11-26 11:34:00,16,53
617,IRYO_26-11-2025-10.04,71801,60000,IRYO,Frecciarossa,2025-11-26 10:04:00,2025-11-26 13:04:00,22,49
618,IRYO_26-11-2025-10.04,04104,04040,IRYO,Frecciarossa,2025-11-26 10:37:00,2025-11-26 11:34:00,12,38
619,IRYO_26-11-2025-10.04,04104,60000,IRYO,Frecciarossa,2025-11-26 10:37:00,2025-11-26 13:04:00,18,56
620,IRYO_26-11-2025-10.04,04040,60000,IRYO,Frecciarossa,2025-11-26 11:37:00,2025-11-26 13:04:00,17,50
621,IRYO_26-11-2025-13.04,71801,60000,IRYO,Frecciarossa,2025-11-26 13:04:00,2025-11-26 15:34:00,17,60
622,IRYO_26-11-2025-17.04,71801,60000,IRYO,Frecciarossa,2025-11-26 17:04:00,2025-11-26 19:34:00,18,52
623,IRYO_26-11-2025-20.55,71801,60000,IRYO,Frecciarossa,2025-11-26 20:55:00,2025-11-26 23:25:00,15,50
624,IRYO_27-11-2025-06.05,60000,71801,IRYO,Frecciarossa,2025-11-27 06:05:00,2025-11-27 08:35:00,22,57
625,IRYO_27-11-2025-07.30,60000,04040,IRYO,Frecciarossa,2025-11-27 07:30:00,2025-11-27 08:50:00,25,53
626,IRYO_27-11-2025-07.30,60000,71801,IRYO,Frecciarossa,2025-11-27 07:30:00,2025-11-27 10:25:00,32,62
627,IRYO_27-11-2025-07.30,04040,71801,IRYO,Frecciarossa,2025-11-27 08:53:00,2025-11-27 10:25:00,23,58
628,IRYO_27-11-2025-10.35,60000,71801,IRYO,Frecciarossa,2025-11-27 10:35:00,2025-11-27 13:05:00,20,50
629,IRYO_27-11-2025-14.35,60000,04040,IRYO,Frecciarossa,2025-11-27 14:35:00,2025-11-27 15:55:00,25,64
630,IRYO_27-11-2025-14.35,60000,04104,IRYO,Frecciarossa,2025-11-27 14:35:00,2025-11-27 16:55:00,18,44
631,IRYO_27-11-2025-14.35,60000,71801,IRYO,Frecciarossa,2025-11-27 14:35:00,2025-11-27 17:35:00,30,74
632,IRYO_27-11-2025-14.35,04040,04104,IRYO,Frecciarossa,2025-11-27 15:58:00,2025-11-27 16:55:00,13,42
633,IRYO_27-11-2025-14.35,04040,71801,IRYO,Frecciarossa,2025-11-27 15:58:00,2025-11-27 17:35:00,24,53
634,IRYO_27-11-2025-14.35,04104,71801,IRYO,Frecciarossa,2025-11-27 16:58:00,2025-11-27 17:35:00,18,62
635,IRYO_27-11-2025-20.35,60000,71801,IRYO,Frecciarossa,2025-11-27 20:35:00,2025-11-27 23:05:00,18,44
636,IRYO_27-11-2025-06.04,71801,04040,IRYO,Frecciarossa,2025-11-27 06:04:00,2025-11-27 07:19:00,16,57
637,IRYO_27-11-2025-06.04,71801,60000,IRYO,Frecciarossa,2025-11-27 06:04:00,2025-11-27 08:59:00,33,64
638,IRYO_27-11-2025-06.04,04040,60000,IRYO,Frecciarossa,2025-11-27 07:22:00,2025-11-27 08:59:00,17,47
639,IRYO_27-11-2025-10.04,71801,04104,IRYO,Frecciarossa,2025-11-27 10:04:00,2025-11-27 10:34:00,17,49
640,IRYO_27-11-2025-10.04,71801,04040,IRYO,Frecciarossa,2025-11-27 10:04:00,2025-11-27 11:34:00,16,53
641,IRYO_27-11-2025-10.04,71801,60000,IRYO,Frecciarossa,2025-11-27 10:04:00,2025-11-27 13:04:00,22,49
642,IRYO_27-11-2025-10.04,04104,04040,IRYO,Frecciarossa,2025-11-27 10:37:00,2025-11-27 11:34:00,12,38
643,IRYO_27-11-2025-10.04,04104,60000,IRYO,Frecciarossa,2025-11-27 10:37:00,2025-11-27 13:04:00,18,56
644,IRYO_27-11-2025-10.04,04040,60000,IRYO,Frecciarossa,2025-11-27 11:37:00,2025-11-27 13:04:00,17,50
645,IRYO_27-11-2025-13.04,71801,60000,IRYO,Frecciarossa,2025-11-27 13:04:00,2025-11-27 15:34:00,17,60
646,IRYO_27-11-2025-17.04,71801,60000,IRYO,Frecciarossa,2025-11-27 17:04:00,2025-11-27 19:34:00,18,52
647,IRYO_27-11-2025-20.55,71801,60000,IRYO,Frecciarossa,2025-11-27 20:55:00,2025-11-27 23:25:00,15,50
648,IRYO_28-11-2025-06.05,60000,71801,IRYO,Frecciarossa,2025-11-28 06:05:00,2025-11-28 08:35:00,22,57
649,IRYO_28-11-2025-07.30,60000,04040,IRYO,Frecciarossa,2025-11-28 07:30:00,2025-11-28 08:50:00,25,53
650,IRYO_28-11-2025-07.30,60000,71801,IRYO,Frecciarossa,2025-11-28 07:30:00,2025-11-28 10:25:00,32,62
651,IRYO_28-11-2025-07.30,04040,71801,IRYO,Frecciarossa,2025-11-28 08:53:00,2025-11-28 10:25:00,23,58
652,IRYO_28-11-2025-10.35,60000,71801,IRYO,Frecciarossa,2025-11-28 10:35:00,2025-11-28 13:05:00,20,50
653,IRYO_28-11-2025-14.35,60000,04040,IRYO,Frecciarossa,2025-11-28 14:35:00,2025-11-28 15:55:00,25,64
654,IRYO_28-11-2025-14.35,60000,04104,IRYO,Frecciarossa,2025-11-28 14:35:00,2025-11-28 16:55:00,18,44
655,IRYO_28-11-2025-14.35,60000,71801,IRYO,Frecciarossa,2025-11-28 14:35:00,2025-11-28 17:35:00,30,74
656,IRYO_28-11-2025-14.35,04040,04104,IRYO,Frecciarossa,2025-11-28 15:58:00,2025-11-28 16:55:00,13,42
657,IRYO_28-11-2025-14.35,04040,71801,IRYO,Frecciarossa,2025-11-28 15:58:00,2025-11-28 17:35:00,24,53
658,IRYO_28-11-2025-14.35,04104,71801,IRYO,Frecciarossa,2025-11-28 16:58:00,2025-11-28 17:35:00,18,62
659,IRYO_28-11-2025-20.35,60000,71801,IRYO,Frecciarossa,2025-11-28 20:35:00,2025-11-28 23:05:00,18,44
660,IRYO_28-11-2025-06.04,71801,04040,IRYO,Frecciarossa,2025-11-28 06:04:00,2025-11-28 07:19:00,16,57
661,IRYO_28-11-2025-06.04,71801,60000,IRYO,Frecciarossa,2025-11-28 06:04:00,2025-11-28 08:59:00,33,64
662,IRYO_28-11-2025-06.04,04040,60000,IRYO,Frecciarossa,2025-11-28 07:22:00,2025-11-28 08:59:00,17,47
663,IRYO_28-11-2025-10.04,71801,04104,IRYO,Frecciarossa,2025-11-28 10:04:00,2025-11-28 10:34:00,17,49
664,IRYO_28-11-2025-10.04,71801,04040,IRYO,Frecciarossa,2025-11-28 10:04:00,2025-11-28 11:34:00,16,53
665,IRYO_28-11-2025-10.04,71801,60000,IRYO,Frecciarossa,2025-11-28 10:04:00,2025-11-28 13:04:00,22,49
666,IRYO_28-11-2025-10.04,04104,04040,IRYO,Frecciarossa,2025-11-28 10:37:00,2025-11-28 11:34:00,12,38
667,IRYO_28-11-2025-10.04,04104,60000,IRYO,Frecciarossa,2025-11-28 10:37:00,2025-11-28 13:04:00,18,56
668,IRYO_28-11-2025-10.04,04040,60000,IRYO,Frecciarossa,2025-11-28 11:37:00,2025-11-28 13:04:00,17,50
669,IRYO_28-11-2025-13.04,71801,60000,IRYO,Frecciarossa,2025-11-28 13:04:00,2025-11-28 15:34:00,17,60
670,IRYO_28-11-2025-17.04,71801,60000,IRYO,Frecciarossa,2025-11-28 17:04:00,2025-11-28 19:34:00,18,52
671,IRYO_28-11-2025-20.55,71801,60000,IRYO,Frecciarossa,2025-11-28 20:55:00,2025-11-28 23:25:00,15,50
672,IRYO_29-11-2025-06.05,60000,71801,IRYO,Frecciarossa,2025-11-29 06:05:00,2025-11-29 08:35:00,22,57
673,IRYO_29-11-2025-07.30,60000,04040,IRYO,Frecciarossa,2025-11-29 07:30:00,2025-11-29 08:50:00,25,53
674,IRYO_29-11-2025-07.30,60000,71801,IRYO,Frecciarossa,2025-11-29 07:30:00,2025-11-29 10:25:00,32,62
675,IRYO_29-11-2025-07.30,04040,71801,IRYO,Frecciarossa,2025-11-29 08:53:00,2025-11-29 10:25:00,23,58
676,IRYO_29-11-2025-10.35,60000,71801,IRYO,Frecciarossa,2025-11-29 10:35:00,2025-11-29 13:05:00,20,50
677,IRYO_29-11-2025-14.35,60000,04040,IRYO,Frecciarossa,2025-11-29 14:35:00,2025-11-29 15:55:00,25,64
678,IRYO_29-11-2025-14.35,60000,04104,IRYO,Frecciarossa,2025-11-29 14:35:00,2025-11-29 16:55:00,18,44
679,IRYO_29-11-2025-14.35,60000,71801,IRYO,Frecciarossa,2025-11-29 14:35:00,2025-11-29 17:35:00,30,74
680,IRYO_29-11-2025-14.35,04040,04104,IRYO,Frecciarossa,2025-11-29 15:58:00,2025-11-29 16:55:00,13,42
681,IRYO_29-11-2025-14.35,04040,71801,IRYO,Frecciarossa,2025-11-29 15:58:00,2025-11-29 17:35:00,24,53
682,IRYO_29-11-2025-14.35,04104,71801,IRYO,Frecciarossa,2025-11-29 16:58:00,2025-11-29 17:35:00,18,62
683,IRYO_29-11-2025-20.35,60000,71801,IRYO,Frecciarossa,2025-11-29 20:35:00,2025-11-29 23:05:00,18,44
684,IRYO_29-11-2025-06.04,71801,04040,IRYO,Frecciarossa,2025-11-29 06:04:00,2025-11-29 07:19:00,16,57
685,IRYO_29-11-2025-06.04,71801,60000,IRYO,Frecciarossa,2025-11-29 06:04:00,2025-11-29 08:59:00,33,64
686,IRYO_29-11-2025-06.04,04040,60000,IRYO,Frecciarossa,2025-11-29 07:22:00,2025-11-29 08:59:00,17,47
687,IRYO_29-11-2025-10.04,71801,04104,IRYO,Frecciarossa,2025-11-29 10:04:00,2025-11-29 10:34:00,17,49
688,IRYO_29-11-2025-10.04,71801,04040,IRYO,Frecciarossa,2025-11-29 10:04:00,2025-11-29 11:34:00,16,53
689,IRYO_29-11-2025-10.04,71801,60000,IRYO,Frecciarossa,2025-11-29 10:04:00,2025-11-29 13:04:00,22,49
690,IRYO_29-11-2025-10.04,04104,04040,IRYO,Frecciarossa,2025-11-29 10:37:00,2025-11-29 11:34:00,12,38
691,IRYO_29-11-2025-10.04,04104,60000,IRYO,Frecciarossa,2025-11-29 10:37:00,2025-11-29 13:04:00,18,56
692,IRYO_29-11-2025-10.04,04040,60000,IRYO,Frecciarossa,2025-11-29 11:37:00,2025-11-29 13:04:00,17,50
693,IRYO_29-11-2025-13.04,71801,60000,IRYO,Frecciarossa,2025-11-29 13:04:00,2025-11-29 15:34:00,17,60
694,IRYO_29-11-2025-17.04,71801,60000,IRYO,Frecciarossa,2025-11-29 17:04:00,2025-11-29 19:34:00,18,52
695,IRYO_29-11-2025-20.55,71801,60000,IRYO,Frecciarossa,2025-11-29 20:55:00,2025-11-29 23:25:00,15,50
696,IRYO_30-11-2025-06.05,60000,71801,IRYO,Frecciarossa,2025-11-30 06:05:00,2025-11-30 08:35:00,22,57
697,IRYO_30-11-2025-07.30,60000,04040,IRYO,Frecciarossa,2025-11-30 07:30:00,2025-11-30 08:50:00,25,53
698,IRYO_30-11-2025-07.30,60000,71801,IRYO,Frecciarossa,2025-11-30 07:30:00,2025-11-30 10:25:00,32,62
699,IRYO_30-11-2025-07.30,04040,71801,IRYO,Frecciarossa,2025-11-30 08:53:00,2025-11-30 10:25:00,23,58
700,IRYO_30-11-2025-10.35,60000,71801,IRYO,Frecciarossa,2025-11-30 10:35:00,2025-11-30 13:05:00,20,50
701,IRYO_30-11-2025-14.35,60000,04040,IRYO,Frecciarossa,2025-11-30 14:35:00,2025-11-30 15:55:00,25,64
702,IRYO_30-11-2025-14.35,60000,04104,IRYO,Frecciarossa,2025-11-30 14:35:00,2025-11-30 16:55:00,18,44
703,IRYO_30-11-2025-14.35,60000,71801,IRYO,Frecciarossa,2025-11-30 14:35:00,2025-11-30 17:35:00,30,74
704,IRYO_30-11-2025-14.35,04040,04104,IRYO,Frecciarossa,2025-11-30 15:58:00,2025-11-30 16:55:00,13,42
705,IRYO_30-11-2025-14.35,04040,71801,IRYO,Frecciarossa,2025-11-30 15:58:00,2025-11-30 17:35:00,24,53
706,IRYO_30-11-2025-14.35,04104,71801,IRYO,Frecciarossa,2025-11-30 16:58:00,2025-11-30 17:35:00,18,62
707,IRYO_30-11-2025-20.35,60000,71801,IRYO,Frecciarossa,2025-11-30 20:35:00,2025-11-30 23:05:00,18,44
708,IRYO_30-11-2025-06.04,71801,04040,IRYO,Frecciarossa,2025-11-30 06:04:00,2025-11-30 07:19:00,16,57
709,IRYO_30-11-2025-06.04,71801,60000,IRYO,Frecciarossa,2025-11-30 06:04:00,2025-11-30 08:59:00,33,64
710,IRYO_30-11-2025-06.04,04040,60000,IRYO,Frecciarossa,2025-11-30 07:22:00,2025-11-30 08:59:00,17,47
711,IRYO_30-11-2025-10.04,71801,04104,IRYO,Frecciarossa,2025-11-30 10:04:00,2025-11-30 10:34:00,17,49
712,IRYO_30-11-2025-10.04,71801,04040,IRYO,Frecciarossa,2025-11-30 10:04:00,2025-11-30 11:34:00,16,53
713,IRYO_30-11-2025-10.04,71801,60000,IRYO,Frecciarossa,2025-11-30 10:04:00,2025-11-30 13:04:00,22,49
714,IRYO_30-11-2025-10.04,04104,04040,IRYO,Frecciarossa,2025-11-30 10:37:00,2025-11-30 11:34:00,12,38
715,IRYO_30-11-2025-10.04,04104,60000,IRYO,Frecciarossa,2025-11-30 10:37:00,2025-11-30 13:04:00,18,56
716,IRYO_30-11-2025-10.04,04040,60000,IRYO,Frecciarossa,2025-11-30 11:37:00,2025-11-30 13:04:00,17,50
717,IRYO_30-11-2025-13.04,71801,60000,IRYO,Frecciarossa,2025-11-30 13:04:00,2025-11-30 15:34:00,17,60
718,IRYO_30-11-2025-17.04,71801,60000,IRYO,Frecciarossa,2025-11-30 17:04:00,2025-11-30 19:34:00,18,52
719,IRYO_30-11-2025-20.55,71801,60000,IRYO,Frecciarossa,2025-11-30 20:55:00,2025-11-30 23:25:00,15,50
720,IRYO_01-12-2025-06.05,60000,71801,IRYO,Frecciarossa,2025-12-01 06:05:00,2025-12-01 08:35:00,22,57
721,IRYO_01-12-2025-07.30,60000,04040,IRYO,Frecciarossa,2025-12-01 07:30:00,2025-12-01 08:50:00,25,53
722,IRYO_01-12-2025-07.30,60000,71801,IRYO,Frecciarossa,2025-12-01 07:30:00,2025-12-01 10:25:00,32,62
723,IRYO_01-12-2025-07.30,04040,71801,IRYO,Frecciarossa,2025-12-01 08:53:00,2025-12-01 10:25:00,23,58
724,IRYO_01-12-2025-10.35,60000,71801,IRYO,Frecciarossa,2025-12-01 10:35:00,2025-12-01 13:05:00,20,50
725,IRYO_01-12-2025-14.35,60000,04040,IRYO,Frecciarossa,2025-12-01 14:35:00,2025-12-01 15:55:00,25,64
726,IRYO_01-12-2025-14.35,60000,04104,IRYO,Frecciarossa,2025-12-01 14:35:00,2025-12-01 16:55:00,18,44
727,IRYO_01-12-2025-14.35,60000,71801,IRYO,Frecciarossa,2025-12-01 14:35:00,2025-12-01 17:35:00,30,74
728,IRYO_01-12-2025-14.35,04040,04104,IRYO,Frecciarossa,2025-12-01 15:58:00,2025-12-01 16:55:00,13,42
729,IRYO_01-12-2025-14.35,04040,71801,IRYO,Frecciarossa,2025-12-01 15:58:00,2025-12-01 17:35:00,24,53
730,IRYO_01-12-2025-14.35,04104,71801,IRYO,Frecciarossa,2025-12-01 16:58:00,2025-12-01 17:35:00,18,62
731,IRYO_01-12-2025-20.35,60000,71801,IRYO,Frecciarossa,2025-12-01 20:35:00,2025-12-01 23:05:00,18,44
732,IRYO_01-12-2025-06.04,71801,04040,IRYO,Frecciarossa,2025-12-01 06:04:00,2025-12-01 07:19:00,16,57
733,IRYO_01-12-2025-06.04,71801,60000,IRYO,Frecciarossa,2025-12-01 06:04:00,2025-12-01 08:59:00,33,64
734,IRYO_01-12-2025-06.04,04040,60000,IRYO,Frecciarossa,2025-12-01 07:22:00,2025-12-01 08:59:00,17,47
735,IRYO_01-12-2025-10.04,71801,04104,IRYO,Frecciarossa,2025-12-01 10:04:00,2025-12-01 10:34:00,17,49
736,IRYO_01-12-2025-10.04,71801,04040,IRYO,Frecciarossa,2025-12-01 10:04:00,2025-12-01 11:34:00,16,53
737,IRYO_01-12-2025-10.04,71801,60000,IRYO,Frecciarossa,2025-12-01 10:04:00,2025-12-01 13:04:00,22,49
738,IRYO_01-12-2025-10.04,04104,04040,IRYO,Frecciarossa,2025-12-01 10:37:00,2025-12-01 11:34:00,12,38
739,IRYO_01-12-2025-10.04,04104,60000,IRYO,Frecciarossa,2025-12-01 10:37:00,2025-12-01 13:04:00,18,56
740,IRYO_01-12-2025-10.04,04040,60000,IRYO,Frecciarossa,2025-12-01 11:37:00,2025-12-01 13:04:00,17,50
741,IRYO_01-12-2025-13.04,71801,60000,IRYO,Frecciarossa,2025-12-01 13:04:00,2025-12-01 15:34:00,17,60
742,IRYO_01-12-2025-17.04,71801,60000,IRYO,Frecciarossa,2025-12-01 17:04:00,2025-12-01 19:34:00,18,52
743,IRYO_01-12-2025-20.55,71801,60000,IRYO,Frecciarossa,2025-12-01 20:55:00,2025-12-01 23:25:00,15,50
